,title,story,genre
0,그린 북,1962년 미국 입담과 주먹만 믿고 살아가던 토니 발레롱가비고 모텐슨는 교양과 우아함 그 자체인천재 피아니스트 돈 셜리마허샬라 알리 박사의 운전기사 면접을 보게 된다백악관에도 초청되는 등 미국 전역에서 콘서트 요청을 받으며 명성을 떨치고 있는 돈 셜리는위험하기로 소문난 미국 남부 투어 공연을 떠나기로 결심하고투어 기간 동안 자신의 보디가드 겸 운전기사로 토니를 고용한다거친 인생을 살아온 토니 발레롱가와 교양과 기품을 지키며 살아온 돈 셜리 박사생각 행동 말투 취향까지 달라도 너무 다른 두 사람은그들을 위한 여행안내서 그린북에 의존해 특별한 남부 투어를 시작하는데,드라마
1,가버나움,나를 세상에 태어나게 한 부모님을 고소하고 싶어요출생기록조차 없이 살아온 어쩌면 12살 소년 자인으로부터,드라마
2,베일리 어게인,귀여운 소년 이든의 단짝 반려견 베일리는 행복한 생을 마감한다하지만 눈을 떠보니 다시 시작된 견생 2회차 아니 3회차1등 경찰견 엘리에서 찰떡같이 마음을 알아주는 소울메이트 티노까지다시 태어날 때마다 성별과 생김새 직업에 이름도 바뀌지만여전히 영혼만은 사랑 충만 애교 충만 주인바라기 베일리어느덧 견생 4회차 방랑견이 되어 떠돌던 베일리는마침내 자신이 돌아온 진짜 이유를 깨닫고 어딘가로 달려가기 시작하는데,모험
3,주전장,일본의 인종차별 문제를 다룬 영상을 올린 후 우익들의 공격 대상이 된 일본계 미국인 유튜버 미키 데자키 그는 일본군위안부에 관한 기사를 쓴 기자가 우익들에게 인신공격 당하는 것을 보며 왜 그토록 이들이 이 문제를 감추려고 하는지 궁금해졌다호기심을 안고 찾아간 그들은 무시무시한 이야기를 전하고 그들의 주장을 반격하는 또 다른 인물들을 만나면서 숨겨진 비밀을 발견하게 되는데 숨 쉴 틈 없는 전쟁이 시작된다,다큐멘터리
4,포드 V 페라리,1960년대 매출 감소에 빠진 포드는 판매 활로를 찾기 위해스포츠카 레이스를 장악한 절대적 1위 페라리와의 인수 합병을 추진한다막대한 자금력에도 불구 계약에 실패하고 엔초 페라리로부터 모욕까지 당한 헨리 포드 2세는르망 24시간 레이스에서 페라리를 박살 낼 차를 만들 것을 지시한다 불가능을 즐기는 두 남자를 주목하라세계 3대 자동차 레이싱 대회이자 지옥의 레이스로 불리는 르망 24시간 레이스출전 경험조차 없는 포드는 대회 6연패를 차지한 페라리에 대항하기 위해르망 레이스 우승자 출신 자동차 디자이너 캐롤 셸비맷 데이먼를 고용하고 그는 누구와도 타협하지 않지만 열정과 실력만큼은 최고인 레이서 켄 마일스크리스찬 베일를 자신의 파트너로 영입한다포드의 경영진은 제 멋대로인 켄 마일스를 눈엣가시처럼 여기며자신들의 입맛에 맞춘 레이스를 펼치기를 강요하지만두 사람은 어떤 간섭에도 굴하지 않고 불가능을 뛰어넘기 위한 질주를 시작하는데그 어떤 각본보다 놀라운 실화가 펼쳐진다,액션
5,아일라,1950년 한국전쟁에 파병된 슐레이만은 칠흑 같은 어둠 속 홀로 남겨진 5살 소녀를 발견한다 전쟁과 부모를 잃은 충격 속에 말을 잃은 소녀 슐레이만은 소녀에게 터키어로 달이라는 뜻의 아일라라는 이름을 지어주고 함께 부대로 향한다 서로에게 무엇과도 바꿀 수 없는 가장 소중한 존재가 된 두 사람 그러나 행복도 잠시 슐레이만은 종전과 함께 고국으로 돌아가라는 명령을 받게 되고 아일라를 끝까지 지켜내기 위해 모두의 반대 속에 자신의 선택을 감행하게 되는데  전 세계를 감동시킨 위대한 이야기가 찾아온다,드라마
6,원더,누구보다 위트 있고 호기심 많은 매력 부자 어기제이콥 트렘블레이 하지만 남들과 다른 외모로 태어난 어기는 모두가 좋아하는 크리스마스 대신 얼굴을 감출 수 있는 할로윈을 더 좋아한다 10살이 된 아들에게 더 큰 세상을 보여주고 싶었던 엄마 이사벨줄리아 로버츠과 아빠 네이트오웬 윌슨는  어기를 학교에 보낼 준비를 하고 동생에게 모든 것을 양보해왔지만  누구보다 그를 사랑하는 누나 비아도 어기의 첫걸음을 응원해준다  그렇게 가족이 세상의 전부였던 어기는 처음으로 헬멧을 벗고 낯선 세상에 용감하게 첫발을 내딛지만  첫날부터 남다른 외모로 화제의 주인공이 되고 사람들의 시선에 큰 상처를 받는다 그러나 어기는 27번의 성형수술을 견뎌낸 긍정적인 성격으로 다시 한번 용기를 내고  주변 사람들도 하나둘 변하기 시작하는데,드라마
7,당갈,전직 레슬링 선수였던 마하비르 싱 포갓아미르 칸은 아버지의 반대로 금메달의 꿈을 이루지 못한 채 레슬링을 포기한다아들을 통해 꿈을 이루겠다는 생각은 내리 딸만 넷이 태어나면서 좌절된다그러던 어느 날 두 딸이 또래 남자아이들을 신나게 때린 모습에서 잠재력을 발견하고 레슬링 특훈에 돌입한다사람들의 따가운 시선과 조롱에도 불구하고 첫째 기타파티마 사나 셰이크와 둘째 바비타산야 말호트라는아버지의 훈련 속에 재능을 발휘 승승장구 승리를 거두며 국가대표 레슬러로까지 성장해 마침내 국제대회에 출전하는데,드라마
8,쇼생크 탈출,촉망 받던 은행 부지점장 앤디팀 로빈슨 分는 아내와 그 애인을 살해한 혐의로 종신형을 받고 쇼생크 교도소에 수감된다강력범들이 수감된 이곳에서 재소자들은 짐승 취급 당하고 혹여 간수 눈에 잘못 보였다가는 개죽음 당하기 십상이다처음엔 적응 못하던 앤디는 교도소 내 모든 물건을 구해주는 레드모건 프리먼 分와 친해지며 교도소 생활에 적응하려 하지만 악질 재소자에게 걸려 강간까지 당한다그러던 어느 날 간수장의 세금 면제를 도와주며 간수들의 비공식 회계사로 일하게 되고 마침내는 소장의 검은 돈까지 관리해주게 된다덕분에 교도소 내 도서관을 열 수 있게 되었을 무렵 신참내기 토미길 벨로우스 分로부터 앤디의 무죄를 입증할 기회를 얻지만 노튼 소장은 앤디를 독방에 가두고 토미를 무참히 죽여버리는데,드라마
9,터미네이터 2:오리지널,미래 인류와 기계의 전쟁은 계속 되는 가운데 스카이넷은 인류 저항군 사령관 존 코너를 없애기 위해액체 금속형 로봇인 T1000을 과거의 어린 존 코너에게로 보낸다 미래의 인류 운명을 쥔 어린 존 코너 스카이넷의 T1000은 거침없이 숨 가쁜 추격을 시작하는데,SF
10,보헤미안 랩소디,공항에서 수하물 노동자로 일하며 음악의 꿈을 키우던 이민자 출신의 아웃사이더 파록버사라보컬을 구하던 로컬 밴드에 들어가게 되면서 프레디 머큐리라는 이름으로 밴드 퀸을 이끌게 된다 시대를 앞서가는 독창적인 음악과 화려한 퍼포먼스로 관중들을 사로잡으며 성장하던 퀸은 라디오와 방송에서 외면을 받을 것이라는 음반사의 반대에도 불구하고 무려 6분 동안 이어지는 실험적인 곡 보헤미안 랩소디로 대성공을 거두며 월드스타 반열에 오른다그러나 독보적인 존재감을 뿜어내던 프레디 머큐리는 솔로 데뷔라는 유혹에 흔들리게 되고결국 오랜 시간 함께 해왔던 멤버들과 결별을 선언하게 되는데세상에서 소외된 아웃사이더에서 전설의 록밴드 퀸이 되기까지우리가 몰랐던 그들의 진짜 이야기가 시작된다,드라마
11,덕구,어린 손자와 살고 있는 일흔 살 덕구 할배는 자신에게 주어진 시간이 얼마 남지 않음을 알게 된다 세상에 덩그러니 남겨질 두 아이들을 위해 할배는 자신을 대신할 사람을 찾아주기로 하고 홀로 먼 길을 떠나 특별한 선물을 준비하는데,드라마
12,나 홀로 집에,크리스마스 시즌의 시카고 말썽꾸러기라 집안 가족들로부터 욕을 듣고 따돌림 당하는 케빈은 늘 자신은 혼자 살거라면서 가족들이 모두 없어졌으면 좋겠다고 생각한다 자기의 치즈 피자를 먹은 형과 싸워 소동을 일으키자 엄마는 케빈을 3층 다락방으로 올려보낸다 케빈의 가족들과 케빈의 집에 온 손님들은 다음 날에 크리스마스 연휴를 이용해 프랑스의 친척 집으로 떠날 계획이었다 그날 밤 바람이 세차게 불어 전화선과 전기선이 끊긴다 케빈의 가족들은 늦잠을 자게 되어 비행기 시간을 맞추기 위해 허둥대다가 그만 3층 다락방에서 잠이 든 케빈을 두고 떠난다 잠에서 깬 케빈은 혼자 남은 것을 알고 하느님이 자신의 소원을 들어주었다고 기뻐한다 비행기를 타고 가던 케빈의 어머니는 무엇인가 빠뜨린 기분에 고민하다가 케빈을 두고 왔음에 놀란다 하지만 전화선이 불통이라 어쩔 수 없다가 프랑스에 도착한 식구들은 목적지로 가고 엄마는 케빈이 걱정이 되어 집으로 돌아갈 비행기표를 사기 위해 안간힘을 쓰지만 연말연휴라 좌석이 없었다혼자 집에 남은 케빈은 형과 누나 방을 구경하면서 즐거워한다 그리고 노래를 부르고 트리도 만들면서 자축한다 그런데 빈집털이 2인조 도둑이 케빈의 집을 호시탐탐 노리고 있다는 것을 알게 되는데,모험
13,월-E,텅 빈 지구에 홀로 남아 수백 년이란 시간을 외롭게 일만 하며 보내던 월E WALLE Waste Allocation Load Lifter EarthClass 지구 폐기물 수거처리용 로봇 그런 그가 매력적인 탐사 로봇 이브와 마주친 순간 잡동사니 수집만이 낙이던 인생에도 소중한 목표가 생긴다 이브는 지구의 미래를 결정할 열쇠가 우연히 월E의 손에 들어간 사실을 알게 되고 고향별로 돌아갈 날만 애타게 기다리는 인간들에게 이를 보고하기 위해 서둘러 우주로 향한다 한편 월E는 이브를 뒤쫓아 은하를 가로지르며 스크린 사상 가장 짜릿한 상상이 넘치는 어드벤처를 선사한다 이제껏 꿈에서도 볼 수 없었던 미래 세계를 배경으로 우주에서 펼쳐지는 월E의 환상적인 모험 애완용 바퀴벌레 용맹스럽지만 어딘가 나사가 빠진 듯한 사회 부적응 로봇 군단 등 일련의 유쾌한 캐릭터들이 여기에 동참한다,애니메이션
14,살인의 추억,1986년 경기도 젊은 여인이 무참히 강간 살해당한 시체로 발견된다 2개월 후 비슷한 수법의 강간살인사건이 연이어 발생하면서 사건은 세간의 주목을 받기 시작하고 일대는 연쇄살인이라는 생소한 범죄의 공포에 휩싸인다  사건 발생지역에 특별수사본부가 설치되고 수사본부는 구희봉 반장변희봉 분을 필두로 지역토박이 형사 박두만송강호 분과 조용구김뢰하 분 그리고 서울 시경에서 자원해 온 서태윤김상경 분이 배치된다 육감으로 대표되는 박두만은 동네 양아치들을 족치며 자백을 강요하고 서태윤은 사건 서류를 꼼꼼히 검토하며 사건의 실마리를 찾아가지만 스타일이 다른 두 사람은 처음부터 팽팽한 신경전을 벌인다 용의자가 검거되고 사건의 끝이 보일 듯 하더니 매스컴이 몰려든 현장 검증에서 용의자가 범행 사실을 부인하면서 현장은 아수라장이 되고 구반장은 파면 당한다  수사진이 아연실색할 정도로 범인은 자신의 흔적을 남기지 않는다 살해하거나 결박할 때도 모두 피해자가 착용했거나 사용하는 물품을 이용한다 심지어 강간사 일 경우 대부분 피살자의 몸에 떨어져 있기 마련인 범인의 음모 조차 단 하나도 발견되지 않는다 후임으로 신동철 반장송재호 분이 부임하면서 수사는 활기를 띠기 시작한다 박두만은 현장에 털 한 오라기 남기지 않는다는 점에 착안 근처의 절과 목욕탕을 뒤지며 무모증인 사람을 찾아 나서고 사건 파일을 검토하던 서태윤은 비오는 날 빨간 옷을 입은 여자가 범행대상이라는 공통점을 밝혀낸다  선제공격에 나선 형사들은 비오는 밤 여경에게 빨간 옷을 입히고 함정 수사를 벌인다 그러나 다음날 아침 돌아오는 것은 또다른 여인의 끔찍한 사체 사건은 해결의 실마리를 다시 감추고 냄비처럼 들끊는 언론은 일선 형사들의 무능을 지적하면서 형사들을 더욱 강박증에 몰아넣는데,범죄
15,빽 투 더 퓨쳐,힐 밸리Hill Valley에 사는 주인공 마티 맥플라이Marty McFly 마이클 J 폭스 분는 록큰롤 스케이트보드 그리고 자동차를 좋아하는 명랑 쾌할한 고교생으로 아버지 죠지George Douglas McFly 크리스핀 글로버 분와 어머니 로레인Lorraine Baines 리아 톰슨 분 그리고 형과 누나가 있는 가정의 평범한 청소년이다 평소 친하게 지내던 괴상한 발명가 에메트 브라운 박사Dr EmmDr Emmett L Doc Brown 크리스토퍼 로이드 분가 스포츠카 드로리안DeLorean을 개조해 타임머신을 만들지만 뜻밖의 사고로 브라운 박사가 테러범들에게 총을 맞고 위험해진 마티는 급기야 30년 전으로 간다극장 간판에는 2류 배우인 로널드 레이건이 보이고 청년인 아버지와 어머니를 보게 된다 그러나 젊은 아버진 여전히 멍청하고 무엇보다 어머니가 미래의 아들인 마티를 좋아해 야단이다 마티가 미래로 가는 것을 도와 줄 사람은 30년 전인 젊은 브라운 박사뿐 댄스 파티가 열리는 날에 아버지와 어머니가 만났던 것을 기억한 마티는 두 사람을 결합시키고자 어머니와 파티장으로 간다 그런데 심술장이 밥Biff Tannen 토마스 F 윌슨 분이 나타나 어머니를 겁탈하려 하나 화가 난 아버지가 일격에 때려 눕혀 그때부터 소심했던 아버지의 성격이 바낀다 무사히 부모님은 만나 마티의 존재는 없었지지 않지만 마티의 미래로의 귀환Back to the future이 어려워지는 사태를 맞는데,SF
16,매트릭스,인간의 기억마저 AI에 의해 입력되고 삭제 되는 세상진짜보다 더 진짜 같은 가상 현실 매트릭스그 속에서 진정한 현실을 인식할 수 없게 재배되는 인간들그 매트릭스를 빠져 나오면서 AI에게 가장 위험한 인물이 된모피어스는 자신과 함께 인류를 구할 마지막 영웅 그를 찾아 헤맨다마침내 모피어스는 낮에는 평범한 회사원으로 밤에는 해커로 활동하는 청년 네오를 그로 지목하는데꿈에서 깨어난 자들 이제 그들이 만드는 새로운 세상이 열린다,SF
17,인생은 아름다워,로마에 갓 상경한 시골 총각 귀도는 운명처럼 만난 여인 도라에게 첫눈에 반한다 넘치는 재치와 유머로 약혼자가 있던 그녀를 사로잡은 귀도는 도라와 단란한 가정을 꾸리며 분신과도 같은 아들 조수아를 얻는다 조수아의 다섯 살 생일 갑작스레 들이닥친 군인들은 귀도와 조수아를 수용소 행 기차에 실어버리고 소식을 들은 도라 역시 기차에 따라 오른다 귀도는 아들을 달래기 위해 무자비한 수용소 생활을 단체게임이라 속이고 1000점을 따는 우승자에게는 진짜 탱크가 주어진다고 말한다 불안한 하루하루가 지나 어느덧 전쟁이 끝났다는 말을 들은 귀도는 마지막으로 조수아를 창고에 숨겨둔 채 아내를 찾아 나서는데전세계를 울린 위대한 사랑 마법처럼 놀라운 이야기가 찾아온다,드라마
18,사운드 오브 뮤직,음악을 사랑하는 말괄량이 견습 수녀 마리아는 원장 수녀의 권유로 해군 명문 집안 폰 트랩가의 가정교사가 된다 마리아는 좀처럼 마음의 문을 열지 않는 폰 트랩가의 일곱 아이들에게 노래를 가르치며 점차 교감하게 되고 엄격한 폰 트랩 대령 역시 마음의 문을 열게 된다 그러던 어느 날 마리아는 자신이 폰 트랩 대령을 사랑하고 있다는 사실을 깨닫게 되고 자신만의 비밀을 간직한 채 아이들의 곁을 떠나 다시 수녀원에 들어가기로 결심하는데,멜로/로맨스
19,라이언 일병 구하기,1944년 6월 6일 노르망디 상륙 작전 오마하 해변에 대기하고 있던 병사들은 한치 앞도 내다볼 수 없는 긴장된 상황과 두려움에 무기력함을 감출 수 없었다 노르망디 해변을 응시하는 밀러 대위Captain Miller 톰 행크스 분 그리고 전쟁 중 가장 어려운 임무를 수행해야할 두려움에 지친 그의 대원들 지옥을 방불케하는 치열한 총격전이 벌어지고 수 많은 병사들이 총 한번 제대로 쏘지 못하고 쓰러져간다 마침내 밀러 대위를 위시한 그들은 몇번의 죽을 고비를 넘기고 맡은 바 임무를 완수한다  같은 시각 2차 대전이 종전으로 치닫는 치열한 전황 속에서 미 행정부는 전사자 통보 업무를 진행하던 중 충격적인 사실을 발견하게 된다 4형제 모두 이 전쟁에 참전한 라이언 가에서 며칠간의 시차를 두고 3형제가 이미 전사하고 막내 제임스 라이언 일병Private Ryan 맷 데몬 분만이 프랑스 전선에 생존해 있음을 알게 된 것이다 네명의 아들 가운데 이미 셋을 잃은 라이언 부인을 위해 미 행정부는 막내 제임스를 구하기 위한 매우 특별한 작전을 지시한다 결국 사령부에서 막내를 찾아 집으로 보낼 임무는 밀러에게 부여되고 이것은 이제껏 수행했던 임무보다 훨씬 어렵고 힘든 것이었다  밀러는 여섯 명의 대원들과 통역병 업햄Corporal Timothy Upham 제레미 데이비스 분 등 새로운 팀을 구성 작전에 투입된다 라이언의 행방을 찾아 최전선에 투입된 밀러와 대원들은 미군에게 접수된 마을을 지나던 중 의외로 쉽게 그를 찾아낸다 하지만 임무 완수의 기쁨도 잠시 그는 제임스 라이언과 성만 같은 다른 인물로 밝혀진다 다음 날 밀러 일행은 우연히 한 부상병을 통해 제임스 라이언이 라멜 지역의 다리를 사수하기 위해 작전에 투입됐고 현재는 독일군 사이에 고립돼 있다는 사실을 듣게 된다  단 한명의 목숨을 구하기 위해 여덟 명이 위험을 감수해야할 상황에서 대원들은 과연 라이언 일병 한 명의 생명이 그들 여덟 명의 생명보다 더 가치가 있는 것인가라는 끊임없는 혼란에 빠진다 하지만 지휘관으로서 작전을 끝까지 책임지고 성공적으로 완수해야 할 밀러는 부하들을 설득해 다시 라이언 일병이 있다는 곳으로 향한다 도중에 독일군과의 간헐적인 전투를 치르면서 결국 밀러 일행은 라멜 외곽지역에서 극적으로 라이언 일병을 찾아낸다 하지만 라이언은 다리를 사수해야할 동료들을 사지에 남겨두고 혼자 돌아가는 것을 거부하는데,전쟁
20,헬프,1963년 미국 남부 미시시피 잭슨 흑인 가정부는 백인 주인과 화장실도 같이 쓸 수 없다 아무도 가정부의 삶에 대해 묻지 않았다 그녀가 책을 쓰기 전까지는 돈 많은 남자와 결혼해 정원과 가정부가 딸린 집의 안주인이 되는 게 최고의 삶이라 여기는 친구들과 달리 대학 졸업 후 작가의 꿈을 이루기 위해 지역 신문사에 취직한 스키터엠마 스톤 살림 정보 칼럼의 대필을 맡게 된 그녀는 베테랑 가정부 에이빌린바이올라 데이비스에게 도움을 요청한다  다른 인생은 꿈꿔보지도 못한 채 가정부가 되어 17명의 백인 아이를 헌신적으로 돌봤지만 정작 자신의 아들은 사고로 잃은 에이빌린 스키터에게 살림 노하우를 알려주던 그녀는 어느 누구도 관심 갖지 않았던 자신과 흑인 가정부들의 인생을 책으로 써보자는 위험한 제안을 받는다  때 마침 주인집의 화장실을 썼다는 황당한 이유로 쫓겨난 가정부 미니옥타비아 스펜서가 두 여자의 아슬아슬하지만 유쾌한 반란에 합류한다 차별과 불만을 이야기 하는 것조차 불법이 되고 생명을 위협받는 일이 되는 시대에 태어나 처음으로 누군가에게 자신들의 이야기를 털어 놓기 시작하는 에이빌린과 미니 그녀들의 용기 있는 고백은 세상을 발칵 뒤집을 만한 책을 탄생시키는데,드라마
21,포레스트 검프,불편한 다리 남들보다 조금 떨어지는 지능을 가진 외톨이 소년 포레스트 검프 헌신적이고 강인한 어머니의 보살핌과 콩깍지 첫사랑 소녀 제니와의 만남으로 사회의 편견과 괴롭힘 속에서도 따뜻하고 순수한 마음을 지니고 성장한다여느 날과 같이 또래들의 괴롭힘을 피해 도망치던 포레스트는 누구보다 빠르게 달릴 수 있는 자신의 재능을 깨닫고 늘 달리는 삶을 살아간다 포레스트의 재능을 발견한 대학에서 그를 미식축구 선수로 발탁하고 졸업 후에도 뛰어난 신체능력으로 군에 들어가 누구도 예상치 못한 성과를 거둬 무공훈장을 수여받는 등 탄탄한 인생 가도에 오르게 된 포레스트하지만 영원히 행복할 것만 같았던 시간도 잠시 어머니가 병에 걸려 죽음을 맞이하고 첫사랑 제니 역시 그의 곁을 떠나가며 다시 한번 인생의 전환점을 맞이하게 되는데 과연 포레스트는 진정한 삶의 행복을 발견할 수 있을까진정한 삶의 가치와 의미를 제시하는 감동 바이블올 가을 다시 한번 세상에서 가장 눈부신 달리기가 시작된다 Run Forrest Run,드라마
22,안녕 베일리,함께라서 행복해환생만 벌써 5번째 도무지 끝날 줄 모르는 베일리의 삶에 새로운 미션이 생겼다 바로 이든의 작은 베이비 씨제이를 돌보는 것옆에 있어줘서 고마워소꿉놀이도 해야 하고 위험한 곳에 들어가면 짖어서 알려줘야 하고 씨제이와 함께 해야 할 일이 너무나도 많이 남았는데 씨제이는 베일리와 이든의 곁을 떠나 도시로 향한다 7년 후 몰리로 다시 태어난 베일리는 우여곡절 끝에 씨제이의 집으로 입양되고 씨제이가 행복할 때 슬플 때 외로울 때 항상 옆에 있어준다혼자 둬서 미안해주유소의 빅독으로 다시 태어난 베일리 씨제이를 만나기만을 기다리지만 우연히 만나게 된 씨제이는 베일리를 알아보지 못하고 떠나버린다내 인생은 온통 너야 사랑해킁킁킁 어디서 씨제이 냄새 안나요 맥스로 환생한 베일리는 오직 일견단심 씨제이를 기다리던 중 유기견 입양소에서 드디어 씨제이를 다시 만나게 된다인생은 길고 견생은 짧다는데 저 녀석을 끝까지 지켜줄 수 있을까,가족
