,title,story,genre
181,뷰티풀 마인드,40년대 최고의 엘리트들이 모이는 프린스턴 대학원 시험도 보지 않고 장학생으로 입학한 웨스트버지니아 출신의 한 천재가 캠퍼스를 술렁이게 만든다 너무도 내성적이라 무뚝뚝해 보이고 오만이라 할 정도로 자기 확신에 차 있는 수학과 새내기 존 내쉬 누구도 따라올 수 없는 뛰어난 두뇌와 수려한 용모를 지녔지만 괴짜 천재인 그는 기숙사 유리창을 노트 삼아 단 하나의 문제에 매달린다 바로 자신만의 오리지날 아이디어를 찾아내는 것 어느 날 짖궂은 친구들과 함께 들른 술집에서 금발 미녀를 둘러싸고 벌이는 친구들의 경쟁을 지켜보던 존 내쉬는 섬광같은 직관으로 균형이론의 단서를 발견한다 1949년 27쪽 짜리 논문을 발표한 20살의 청년 존 내쉬는 하루 아침에 학계의 스타로 제2의 아인슈타인으로 떠오른다  이후 MIT 교수로 승승장구하던 그는 정부 비밀요원 윌리암 파처를 만나 냉전시대 최고의 엘리트들이 그러하듯 소련의 암호 해독 프로젝트에 비밀리에 투입된다 하지만 정작 그를 당황케 한 것은 몇 만개의 암호가 아닌 사랑이란 인생의 난제였다 자신의 수업을 듣던 물리학도 알리샤와 사랑에 빠진 그는 난생처음 굳게 닫혔던 마음의 문을 열고 둘은 행복한 결혼에 골인한다 알리샤와의 결혼 후에도 존은 윌리암과의 프로젝트를 비밀리에 수행한다 하지만 점점 소련 스파이가 자신을 미행한다는 생각에 사로잡히는 존 목숨의 위협에도 불구하고 아내에게 끝까지 자신의 일을 비밀로 하지만 자신의 영혼의 빛이 점점 꺼져가고 있음을 깨닫지 못하는데  {내쉬의 이론Nashs theories은 세계 무역 협상 국가노동관계 그리고 심지어 생물진화에 까지 영향을 미쳤다 존John과 엘리사Alicia는 뉴저지의 프린스턴Princeton New Jersey에 살고 있으며 수학과the Mathematics Department를 지키고 있다 그리고 존은 아직도 매일 캠퍼스를 걸어서 다니고 있다},드라마
182,인크레더블 2,슈퍼맘 헬렌이 국민 히어로 일라스티걸로 활약하며 세상의 주목을 받자바쁜 아내의 몫까지 집안일을 하기 위해 육아휴직을 낸 아빠 밥은질풍노도 시기의 딸 바이올렛 자기애가 넘치는 아들 대쉬어마무시한 능력을 시도때도 없이 방출하는 막내 잭잭까지 전담하며전쟁같은 하루하루를 보낸다그러던 어느 날각자의 위치에서 바쁜 일상을 보내던 슈퍼파워 가족 앞에 새로운 악당이 나타났다다시 한번 세상을 구하기 위해 나선 가족은인크레더블한 능력을 발휘할 수 있을까,애니메이션
183,타인의 삶,1984년 동독 비밀경찰슈타지의 감시로부터 자신도 모르게 철저히 조사 당했던 동독의 국민들 보이지 않는 정보국 요원의 삶 10만 명의 비밀경찰과 20만 명이 넘는 스파이 그들의 목표는 단 하나 모든 것을 알아야 한다베를린 장벽이 무너지기 5년 전 나라와 자신의 신념을 맹목적으로 고수하던 냉혈인간  비밀경찰 비즐러는 동독 최고의 극작가 드라이만과 그의 애인이자 인기 여배우 크리스타를 감시하는 중대 임무를 맡는다 그러나 시간이 지날수록 드라이만을 체포할 만한 단서는 찾을 수 없다 비즐러는 오히려 드라이만과 크리스타의 삶으로 인해 감동받고 사랑을 느끼며 이전의 삶과는 달리 인간적인 모습으로 변화하기 시작하는데,드라마
184,사랑은 비를 타고,아마츄어 쇼 코미디언인 돈 록우드Don Lockwood 진 켈리 분와 코스모Cosmo Brown 도날드 오코너 분는 공연을 하며 이곳저곳을 떠돌아다니다 뜻대로 되지않자 새 일자리를 얻기위해 헐리우드로 온다 그런데 우연찮게 돈 록우드는 마뉴멘탈 영화사의 스턴트맨역을 따내게 되고 당시 최고의 인기를 누리고 있던 여배우인 리나 레이먼트Lina Lamont 쟌 하겐 분와 함께 다수의 영화에 출연함으로써 단연 스타로 급부상하게 된다  그러나 화려한 영광도 잠시 헐리웃 영화계가 무성영화에서 유성영화 체제로 전환됨으로써 목소리 연기가 너무나 형편없는 리나 레이먼트 때문에 영화를 완전히 망치게 된다 그 때문에 돈 록우드와 그의 영화는 완전히 인기를 잃게 된다 그러던 중 록우드는 파티장에서 우연히 만난 캐시Kathy Selden 데비 레이놀즈 분라는 여자에게 사랑을 느끼게 되고 연극 배우를 꿈꾸는 아름답고 재능있는 캐시에게서 결정적인 도움을 받게 된다 그 도움이란 영화를 새롭게 각색한 뮤지컬 노래하는 기사를 살리고자 리나의 입을 빌려 캐시의 목소리를 내보내기로 한 것이다  아무것도 모르던 리나는 나중에 사실을 알고 분을 참지 못하고 캐시를 영화계에서 완전히 생매장시켜 버리려 한다 하지만 리나는 자기의 비열한 속임수에 자기가 말려들어 많은 관중들 앞에서 모욕을 당하게 되고 캐시와 돈 록우드는 서로에 대한 사랑을 다시 한번 확인하게 된다,뮤지컬
185,페이스 오프,불굴의 FBI요원인 숀 아처Sean Archer 존 트라볼타 분는 자신의 어린 아들인 마이키를 죽인 냉혹한 범죄자이자 LA 어딘가에 생화학 폭탄을 장착해둔 악독한 청부 테러범인 캐스터 트로이Castor Troy 니콜라스 케이지 분를 생포해야만 한다 LA를 통째로 날려버릴 수 있는 엄청난 비극을 막아내야만 하기 때문이다 몇 차례의 격돌 끝에 숀은 국외로 탈출하려던 트로이를 생포하지만 체포된 순간 캐스터는 코마에 빠져서 의식불명이 되어버린다 촌각을 다투는 가운데 폭탄제거 임무를 위하여 숀은 FBI의 첨단 의학 기술진의 도움을 받아 트로이의 얼굴을 통째로 떠내어 자신의 얼굴에 이식시킨 다음 감옥에 수감중인 캐스터의 동생Pollux Troy 알렉산드로 니볼라 분으로부터 정보를 캐내기 위하여 죄수로 위장하여 감옥에 들어간다 숀의 변신을 모르는 간수들은 숀을 혹독하게 다룬다  한편 코마에 빠져 있던 캐스터는 의식을 회복한 뒤 자신의 얼굴이 통째로 떼어내진 사실을 알고 분노하여 FBI의 의료진을 위협하여 역시 통째로 떼내어 염수에 보관되어 있던 숀의 얼굴을 자신의 얼굴에 이식한 후 비밀을 알고 있는 FBI 요원들을 무참히 살해한다 FBI 요원 숀으로 변신한 트로이는 이제 숀의 가정과 직장에서 숀의 인생을 철저하게 파멸시키기 시작한다 시한폭탄의 초침이 어김없이 돌아가고 있는 가운데 숀이 FBI요원이라는 사실을 알고 있는 극소수의 FBI요원들이 캐스터에게 살해당한 사실을 안 숀은 그의 신분을 노출시키려고 하지만 사실을 알 턱이 없는 간수들은 혹독하게 그를 다룬다  숀은 가까스로 감옥을 탈출한다 경찰과 FBI의 삼엄한 추격 속에 숀은 캐스터의 아지트에 잠입하여 신변의 보호를 받지만 숀으로 위장한 캐스터의 지시를 받은 특전반이 출동하여 숀이 숨어있는 캐스터의 아지트를 벌집으로 만들어버린다 자신의 목숨이 날아갈 수도 있는 위기 상황에서도 숀은 캐스터의 어린 아들이 사살되는 것을 막기 위하여 몸을 아끼지 않는다 숀의 죽은 아들 마이키의 생일날 숀과 캐스터는 마침내 필살의 격돌 상황에 직면한다 FBI와 캐스터의 테러 범죄단이 격돌하고 숀과 캐스터의 본래의 신분이 위협받는 가운데 숀과 캐스터는 서로에게 마지막을 예고하는 총구를 들이대는데,액션
186,투게더,아버지는 저를 천재라고 하시지만 전 그냥 얼굴도 모르고 아버지가 말도 안 해주는 어머니가 보고 싶을 때 바이올린을 연주하는 것 뿐입니다 지역 콩쿨에 출전할 때도 혹시 내가 바이올린으로 유명해지면 혹시 어머니가 절 찾지 않으실까 해서 열심히 한 것 뿐인데 1등도 몇 번 했습니다 아버지는 그럴 때마다 어서 북경에 가서 좋은 선생님을 만나야 한다고 하십니다 저희 집은 너무 가난해서 그럴 수 없다는 것을 잘 아는 저는 부담스럽기만 한데 말이죠  결국 콩쿨에 참가하기 위해 북경에 왔습니다 난생 처음 와 본 대도시 그리고 북경역은 듣던 것보다 훨씬 더 크고 멋집니다 시골에서 막 올라온 촌뜨기 티를 내지 말아야 하는데 아버지의 촌스러운 빨간 모자가 자꾸 맘에 걸립니다 아버지를 창피해하면 안된다는 건 알지만 역 한가운데서 오줌 마렵다고 큰소리로 얘기하시는 아버지를 보면 모른 척하고 싶은 게 사실입니다 아버지는 저를 너무 사랑하시고 저의 성공시키기 위해 고생하고 계시다는 걸 잘 알면서도 말입니다  그런데 역에서 우연히 천사처럼 예쁜 누나를 봤습니다 저도 모르게 그 누나를 따라갔고 말 한 마디도 못 건네 봤지만 그 후로는 온통 누나 생각 뿐입니다 그래서 콩쿨에서 5등한 것도 신경 안 쓰입니다 그런데 누나와 나는 운명인지 누나는 우리가 구한 집의 옆집에 살고 있었습니다 릴리라는 멋진 이름의 그 누나는 마침  제 바이올린 소리를 좋아해 우린 금방 친해지게 되었습니다 누나는 애인도 있고 돈 때문에 남자들을 만나는 것 같지만 우리 아버지처럼 촌스럽지 않고 쿨해서 전 너무 좋습니다 누나를 위해서라면 무엇이든 할 거예요  바이올린 선생님이신 지앙 교수님도 너무 좋습니다 처음엔 괴팍한 성격에 길잃은 고양이들이나 주워다 기르고 청소는 물론이고 옷도 안 갈아입는 정말 이상한 분이라고 생각했지만 교수님과 함께하는 고양이 밥주기와  청소도 재밌습니다 그러면서 교수님이 제게 즐거울 때만 연주하라고 말씀하신 게  무슨 의미인지도 조금씩 깨닫게 되었구요 지앙 교수님은 정말 훌륭한 분입니다  그런데 아버지가 저에게는 한마디 상의도 없이 새로운 선생님을 찾았다며 지앙 교수님을 해고했습니다 저는 참을 수가 없습니다 유명하고 훌륭한 선생님도 필요 없습니다 아버지는 제 기분은 안중에도 없고 오로지 바이올린과 성공 밖에 모르십니다 저는 너무 화가 나서 바이올린을 팔아버렸습니다 그리고 그 돈으로 릴리 누나가 갖고 싶어했던 코트를 샀습니다 유교수님 댁에 오디션을 보러 가서 그 사실을 알게 된 아버지는 크게 화를 내며 야단을 치셨고 저도 마구 대들었습니다,드라마
187,그랜 토리노,자동차 공장에서 은퇴한 채 무료한 일상을 보내는 월트클린트 이스트우드 한국전 참전의 상처로 괴로워하는 남편의 참회를 바라던 아내의 유언에도 불구하고 참회할 것이 없다며 버틴다 어느 날 이웃집 소년 타오가 갱단의 협박으로 월트의 72년산 그랜 토리노를 훔치려 하고 뜻하지 않았던 이 만남으로 월트는 차고 속에 모셔두기만 했던 자신의 자동차 그랜 토리노처럼 전쟁 이후 닫아둔 자신의 진심을 드러내기 시작하는데,범죄
188,명탐정 코난: 천공의 난파선,명쾌한 추리와 시원한 액션으로 사건을 해결했던 코난 이번에는 세계 최대 비행선에서 벌어지는 사건에 휘말리게 된다 살인 박테리아로 위협하는 테러리스트 조직 붉은 샴고양이 보석을 훔치며 코난과 두뇌대결을 펼치는 괴도키드 붉은 샴고양이가 진짜 노리는 것은 괴도키드가 훔치는 것은 보석 아니면 미란이의 마음 스릴 넘치는 액션과 반전이 거듭되는 운명의 삼각대결,애니메이션
189,"님아, 그 강을 건너지 마오",89세 소녀감성 강계열 할머니 98세 로맨티스트 조병만 할아버지 이들은 어딜 가든 고운 빛깔의 커플 한복을 입고 두 손을 꼭 잡고 걷는 노부부이다  봄에는 꽃을 꺾어 서로의 머리에 꽂아주고 여름엔 개울가에서 물장구를 치고 가을엔 낙엽을 던지며 장난을 치고 겨울에는 눈싸움을 하는 매일이 신혼 같은 백발의 노부부  장성한 자녀들은 모두 도시로 떠나고 서로를 의지하며 살던 어느 날 할아버지가 귀여워하던 강아지 꼬마가 갑자기 세상을 떠난다 꼬마를 묻고 함께 집으로 돌아온 이후부터 할아버지의 기력은 점점 약해져 가는데  비가 내리는 마당 점점 더 잦아지는 할아버지의 기침소리를 듣던 할머니는 친구를 잃고 홀로 남은 강아지를 바라보며 머지 않아 다가올 또 다른 이별을 준비한다,다큐멘터리
190,고 녀석 맛나겠다,화산이 분출하던 아주 머나먼 옛날 육식공룡 티라노사우르스 하트는 길을 걷다 공룡알 하나를 발견한다 톡톡 건드리자 알에서 깨어난 초식공룡 아기 안킬로사우르스 한입에 냉큼 삼킬 생각에 고 녀석 맛나겠다라고 군침을 흘리는 하토를 처음 본 아기 공룡은 그러나 티라노사우르스 무서운 줄 모르는데 맛나가 자신의 이름인 줄만 아는 아기공룡은 하트를 아빠라고 부르며 따르게 된다 얼떨결에 아빠가 되어버린 육식공룡 하트와 그런 아빠를 무서워하지 않는 초식공룡 아들 맛나 절대 아빠와 아들 사이가 될 수 없을 것 같은 이들의 아슬아슬하고도 신나는 모험이 이제 시작된다,애니메이션
191,위대한 독재자,세계대전에서 패배한 토매니아국에 힌켈이라는 독재자가 나타나 악명을 떨친다 한편 힌켈과 닮은꼴 외모의 이발사 찰리는 국가의 유태인 탄압정책으로 인해 곤경에 처하지만 병사로 참전했던 전쟁에서 우연히 구해줬던 슐츠 장교의 도움을 받아 위기를 모면한다 독재자 힌켈의 악행은 갈수록 도를 더해가고 찰리는 유태인 수용소에 끌려가게 되지만 기지를 부려 탈옥에 성공한다 하지만 이발사와 똑같은 얼굴을 한 힌켈이 탈옥범으로 오해 받아 감옥에 잡혀 들어가게 되는데,코미디
192,1987,1987년 1월 경찰 조사를 받던 스물두 살 대학생이 사망한다 증거인멸을 위해 박처장김윤석의 주도 하에 경찰은 시신 화장을 요청하지만  사망 당일 당직이었던 최검사하정우는 이를 거부하고 부검을 밀어붙인다 단순 쇼크사인 것처럼 거짓 발표를 이어가는 경찰  그러나 현장에 남은 흔적들과 부검 소견은 고문에 의한 사망을 가리키고  사건을 취재하던 윤기자이희준는 물고문 도중 질식사를 보도한다  이에 박처장은 조반장박희순등 형사 둘만 구속시키며 사건을 축소하려 한다 한편 교도소에 수감된 조반장을 통해 사건의 진상을 알게 된 교도관 한병용유해진은  이 사실을 수배 중인 재야인사에게 전달하기 위해 조카인 연희김태리에게 위험한 부탁을 하게 되는데  한 사람이 죽고 모든 것이 변화하기 시작했다 모두가 뜨거웠던 1987년의 이야기,드라마
193,인셉션,타인의 꿈에 들어가 생각을 훔치는 특수 보안요원 코브그를 이용해 라이벌 기업의 정보를 빼내고자 하는 사이토는코브에게 생각을 훔치는 것이 아닌 생각을 심는 인셉션 작전을 제안한다성공 조건으로 국제적인 수배자가 되어있는 코브의 신분을 바꿔주겠다는거부할 수 없는 제안을 하고 사랑하는 아이들에게 돌아가기 위해 그 제안을 받아들인다최강의 팀을 구성 표적인 피셔에게 접근해서 인셉션 작전을 실행하지만예기치 못한 사건들과 마주하게 되는데꿈 VS 현실시간 규칙 타이밍 모든 것이 완벽해야만 하는단 한 번도 성공한 적 없는 인셉션 작전이 시작된다,액션
194,레드슈즈,사건 사고가 끊이지 않는 동화의 섬 사라진 아빠를 찾던 화이트 왕국의 공주는우연히 마법구두를 신고 이전과 완벽하게 다른 레드슈즈로 거듭난다한편 초록색 난쟁이가 된 일곱 왕자들은 우연히 자신들의 집에 머물게 된 레드슈즈가저주를 풀 유일한 희망이라 생각해 그녀를 돕기 시작하고 영원한 아름다움을 꿈꾸는 왕비 레지나는마법구두를 신고 성을 빠져나간 레드슈즈를 쫓기 시작하는데위기에 빠진 동화의 섬 레드슈즈 그리고 일곱 왕자들의 운명은,애니메이션
195,바람과 함께 사라지다,1부  대농장 타라를 소유한 오하라 가문의 장녀 스칼렛은 이웃에 사는 청년 애슐리를 사모해왔다 그러나 애슐리가 친구 멜라니와 결혼한다는 이야기를 듣게 된 스칼렛은 뒤늦게 사랑을 고백하지만 거절당하는데 무역으로 많은 돈을 번 레트 선장이 이 모습을 숨어서 지켜보고 있었다그무렵 남북전쟁이 발발하고 전장으로 떠나며 멜라니를 부탁하는 애슐리에게 질투심이 생긴 스칼렛은 멜라니의 오빠 찰스의 청혼을 받아들여 결혼한다 하지만 찰스는 전장에서 병으로 사망하고 어린 나이에 과부가 된 스칼렛은 애틀랜타로 가서 멜라니의 가족들과 지내게 된다전황은 남군에게 불리해지고 애틀랜타도 북군에 포위된다 피난을 떠나야 하지만 멜라니는 출산을 앞두고 있었고 애슐리의 부탁대로 스칼렛은 그녀의 출산을 돕는다 아기는 무사히 낳았지만 북군의 포격이 애틀랜타를 뒤덮은 상황 스칼렛은 레트에게 도움을 청해 불길을 뚫고 구사일생으로 타라까지 피신한다 하지만 북군이 휩쓸고 간 타라는 황무지로 변해 있었다2부  전쟁이 끝나고 애슐리도 타라로 돌아온다 이후 스칼렛은 농장에 매겨진 세금을 충당하기 위해 장사꾼으로 성공한 동생의 약혼자 프랭크를 가로채 결혼하고 북부 사람들과도 손을 잡으며 재산을 모으기 시작한다 동분서주하며 사업을 확대해가던 스칼렛은 어느 날 흑인 마을에서 성추행을 당하게 되고 애슐리와 함께 이를 복수하러 떠났던 프랭크는 살해된다또다시 과부가 된 스칼렛은 레트의 오랜 구애를 받아들여 그와 결혼한다 레트와의 사이에서 딸 보니를 얻었지만 스칼렛은 여전히 애슐리에 대한 마음을 정리하지 못하고 있었다 이를 알고 있는 레트와의 불화로 스칼렛은 둘째 아기를 유산하는 사고를 겪고 설상가상으로 보니마저 낙마 사고로 목숨을 잃는다 그리고 멜라니의 임종을 지키러 간 자리에서 레트는 여전히 애슐리를 살갑게 대하는 스칼렛의 모습에 그녀를 떠나려고 결심한다하지만 멜라니의 죽음으로 충격받은 애슐리의 모습을 본 스칼렛은 자신이 사랑했던 사람이 그가 아니라 레트라는 사실을 깨닫는다 뒤늦게 스칼렛은 레트를 붙잡으려 하지만 그는 끝내 떠나고 남겨진 채 슬픔에 젖어 있던 스칼렛은 타라로 돌아가 레트를 되찾을 방법을 생각하겠다고 다짐하며 일어선다,드라마
196,빽 투 더 퓨쳐 2,브라운 박사Dr Emmett Doc L Brown 코리스토퍼 로이드 분와 30년 후의 미래로 온 마티Marty McFly 마이클 J 폭스 분와 제니퍼Jennifer Parker 엘리자베스 슈 분 그러나 제니퍼는 타임머쉰과 미래세계에 자신이 있음에 놀라 기절한다 아들을 깽들로부터 구하고 기절한 제니퍼를 데리고 다시 현대로 돌아온 마티와 브라운 박사는 그러나 뒤죽박죽된 세상에 소스라치게 놀란다 아버지는 묘지에 묻혀 있고 어머니는 마티의 집에서 일하던 밥과 원치 않은 결혼을 해 으리으리한 집에 살고 있다 바로 미래에 갔던 마티와 브라운의 타임머신을 그곳에 있던 늙은 밥이 훔쳐타고 그간에 있었던 스포츠 게임의 승부전이 있는 잡지를 60년 전 과거의 젊은 밥Biff TannenGriff 토마스 F 윌슨 분 자신에게 주어 도박으로 일약 부자가 된 것이다,SF
197,석양에 돌아오다,허리춤엔 총자루를 차고 먼지가 뒤덮힌 망토를 두르고 늘 시가를 입에 문채 우수에 찬 눈빚으로 서부를 가르는 신비의 남자 블런디 미국의 남북전쟁이 한창인 때 블런디는 멕시칸 총잡이 투코와 함께 동업 중이다 투코는 현상범 블런디는 그를 잡아 수많은 현상금을 얻어내고 투코가 교수형을 당하는 순간 어디에서인가 총성이 울린다 이때 투코를 매달고 있던 밧줄이  끊어지고 투코는 목숨을 건지는 것 이런 방식으로 이들은 남서부 일대를 휘저으며 위험스런 게임을 해나간다  한편 세텐자라 불리우는 가학적인 범죄자는 엄천난 게임판에 몰두한다 그는 바로 200000의 돈주머니가 묻힌 비밀장소를 추적 중이다 이때 투코와 블런디는 사막의 한가운데서 목숨을 담보로 실랑이를 벌인다 블런디는 투코가 그를 배신하고 막 죽일려고 하는 순간 우연히 그 돈주머니가 묻히 공동묘지를 알게 되고 그만이 그 장소를 알고 있다 투코는 그의 생명과 그의 위치에 대한 지식을 거래할 수 밖에 없는 노릇 그들은 돈이 묻힌 곳에 달하기 위해 남부군복을 입고 나서지만 불행스럽게도 북군의 포로가 되고 수용소에서 아이러닉하게도 세텐자와 대면하게 된다  장교로 이미 자리를 잡고 있는 세텐자는 투코를 고문해서 장소를 알아내려하지만 블런디가 알고있다는 사실을 접하고는 블런디와 흥정에 들어간다 이 위험스런 흥정은 가까스로 수용소를 빠져나온 투코가 합류하면서 더욱 뜨거워 지는데 넘어서는 불가능한 여로와 죽음의 전쟁을 통하여 도달한 묘지에서 운명의 3인은 최후의 방아쇠를 당기기 위해 삼각의 위치에 과감히 서서는 긴장의 순간을 맞이하는데,서부
198,똥파리,동료든 적이든 가리지 않고 욕하고 때리며 자기 내키는 대로 살아 온 용역 깡패 상훈 세상 무서울 것 없는 상훈이지만 그에게도 마음 속에 쉽게 떨쳐내지 못할 깊은 상처가 있다 바로 가족이라는 이름이 남긴 슬픔이다 그러던 어느날 우연히 길에서 여고생 연희와 시비가 붙은 상훈 자신에게 전혀 주눅들지 않고 대드는 깡 센 연희가 신기했던 그는 이후 연희와 가까워지고 그녀에게 묘한 동질감을 느낀다 그렇게 조금은 평화로운 일상을 보내던 어느 날 아버지가 15년 만에 출소하면서 상훈은 격한 감정에 휩싸이는데,드라마
199,니모를 찾아서 3D,디즈니픽사 최고의 애니메이션이 3D로 다시 찾아온다호기심 가득한 아기 물고기 니모가 인간에게 납치되자 아들바보 아빠 말린은 상상초월 위험이 도사리고 있는 바다로 아들을 구하기 위한 모험을 떠난다 건망증이 심한 수다쟁이 물고기 도리와 함께 떠나는 모험에서 말린은 과연 아들을 구해낼 수 있을까전 세계가 사랑한 최고의 모험이 3D로 펼쳐진다BONUS STORY의 NEW 에피소드 도 최초 공개됩니다친구들 사이에서 항상 분위기를 망치는 인물로 지목 받는 불쌍한 렉스 하지만 주인인 보니가 목욕시간에 데려가자 렉스는 욕실의 분위기 메이커인 파티공룡으로 새롭게 탄생 하는데,애니메이션
