,title,story,genre
92,천공의 성 라퓨타,조용한 밤하늘에 한척의 비행선이 떠있다 꼬리날개에 그려진 해골 마크가 이 배가 해적선이라는 사실을 말해주고 있다 갑자기 사람들이 뛰어다니면서 기내가 부산스러워진다 그들이 바라보는 곳에는 그 발밑으로 또다른 거대한 비행선 한척이 떠가고 있었다 곧 해적선에 작은 비행정 몇 대가 발진한다 거대한 비행선 방 안에 한 소녀와 검은 양복에 선글라스의 두 남자가 있다 한 남자가 소녀에게 식사를 가져오지만 소녀는 아무말도 없이 고개를 돌려 버린다 창밖을 바라보던 소녀는 이쪽으로 날아오고 있는 해적들의 비행정을 발견하게 된다 곧 해적들의 습격이 시작된다 해적들은 저항하는 선원들을 가볍게 제압하며 배안으로 침입한다 검은 양복을 입은 남자 몇 명이 복도를 막고 해적과 총격전을 벌인다 검은 양복의 우두머리로 보이는 듯한 남자가 그들에게 해적을 막을 것을 지시하고는 다시 방으로 들어와 어디엔가 무전연락을 시작한다 그 모습을 바라보던 소녀는 식탁위에 쓰러져 있던 술병을 조용히 집어들어 그 남자를 내리친다 소녀는 바닥에 쓰러진 남자의 품에서 목걸이를 빼내서 자신의 목에 건다 곧 검은 양복의 남자들의 방어선이 뚫리고 해적들이 문을 부수고 들어온다 바닥에 쓰러진 남자의 몸을 뒤지지만 아무것도 발견하지 못한다 해적들은 창문이 열려있는 것을 발견하고는 창문 밖을 살핀다 창문 밖에는 소녀가 비행선의 벽에 매달려있었다 몸을 내밀어 소녀를 잡으려고 하는 해적들 소녀를 보고 해적들의 우두머리가 외친다 저거다 저 돌이다 비행석이다 해적들이 소녀를 잡으려는 순간 소녀는 비행선에서 떨어져 구름 밑으로 사라지고만다 소녀는 정신을 잃은 채로 거꾸로 떨어지고 있었다 소녀의 목걸이에서 파란 및이 뿜어져 나오더니 소녀의 몸이 수평으로 유지되고 천천히 떨어지게 된다  한 광산마을 파즈는 모처럼의 야근 때문에 야식을 사러 거리로 내려왔다 파즈는 야식을 사서 돌아가던 도중 이상한 물체가 하늘에서 내려오고 있는 것을 보게된다 떨어지는 것이 사람임을 알아챈 파즈 그 사람은 파즈가 일하는 광산으로 떨어지고 있었다 파즈는 그 사람이 내려오고 있는 장소로 달려가서 소녀가 떨어지기 전에 받아낸다 파즈는 하늘에서 여자애가 내려왔다고 아저씨에게 말하려고 하지만 기계가 말썽을 부리고 탄광에 내려갔던 사람들이 돌아오고 하는 통에 말할 기회가 생기지 않는다 아무에게도 얘기하지 못한채 잔업은 끝나고 파즈만이 혼자 남아서 뒷정리를 하게 된다 밤하늘에 아까의 그 해적선이 떠있다작은 비행정으로 아까의 습격에서 떨어져 버린 소녀를 찾고 있다 하지만 날이 어두워서 수색을 포기하고 다음날 다시 찾기로 한다 다음날 아침 파즈는 부시시한 얼굴로 잠에서 깨어난다 침대 위에서는 어제의 그 소녀가 잠자고 있었다 아직 잠들어있는 소녀를 보면서 미소짓는 파즈 파즈는 집 지붕위로 올라가서 새장에서 비둘기를 날려보낸 후 트럼펫을 분다 잠에서 깨어난 소녀는 트럼펫 소리를 따라 지붕위로 올라온다 시타가 자기가 어떻게 살았는지 궁금해하자 파즈는 시타에게 그 목걸이를 잠시 달라고 한다 그 목걸이는 시타의 집에서 예전부터 전해내려 오는 목걸이라 한다 파즈는 목걸이를 메고 지붕에서 뛰어내린다 놀라서 황급히 그쪽으로 달려가보는 시타 바닥에는 벽돌을 뚫고 구멍이 생겨 버렸다 둘은 다시 집 안으로 들어온다 파즈는 시타에게 식사준비를 할 동안 씻고 있으라고 한다 집안을 둘러보는 시타 집 안에는 만들고 있는 비행기가 있었고 벽에는 하늘에 떠있는 성의 그림이 있었다 그림을 바라보고 있는 시타에게 파즈가 다가온다,애니메이션
93,쥬라기 공원,코스타리카 서해안의 한 섬에 세워진 테마 파크 쥬라기 공원 최신 복제 기술로 살아난 공룡들이 활보하는 이곳에 공룡학자를 비롯한 각계의 전문가가 일반 공개에 앞서 정밀 안전 진단을 위한 투어에 나선다 그러나 최첨단 컴퓨터 시스템으로 철저히 통제되고 있는 공룡들이 예기치 않은 사고로 폭주하게 되고 여기에 설상가상으로 태풍까지 몰려오면서 일행들의 투어는 순식간에 생존을 위한 사투의 현장으로 뒤바뀌는데,SF
94,일급 살인,{This Film is Inspired by A True Story 이 영화는 실화가 바탕이다}  1938년 3월 샌프란시스코만의 검푸른 심연에 뿌리를 박은채 우뚝 솟은 한 이름없는 바위섬 바로 그 곳에 앨카트래스란 이름의 감옥이 위치한다 나체의 한 남자가 5피트 깊이의 지하 감방에 던져진다 육중한 철제문이 금속성을 울리며  닫혀지면 한평반 남짓한 독방은 칠흙같은 어둠 속에 잠긴다 이 남자의 이름은 헨리 영Henri Young 케빈 베이컨 분 그는 동생을 위해 단돈 5달러를 훔친 죄명으로 이 지하 감방에서 3년 동안 인간 이하의 삶을 살게 된다  1941년 6월 마침내 그는 앨카트래스의 지하 감방에서 벗어나나 몇시간 후 햇빛 가득한 교도소 식당에서 그는 자신을 그런 고통 속에 몰아넣은 장본인이라고 생각되는 한 사나이를 만나게 된다 그리고 200명의 목격자들이 보는 앞에서 그 자를 살해한다 이 단순한 보복 행위로 인해 헨리 영은 일급살인죄로 기소된다 그의 변호를 맡은 24세의 젊은 관선 변호사 제임스 스탬필James Stamphill 크리스찬 슬레이터 분 제임스는 헨리 영이 지난 3년 동안 지하 독방에서 비인간적이며 짐승과 같은 생활을 한 것에 대해 참을 수 없는 분노를 느낀다 서서히 제임스 스탬필에게 신뢰를 갖게 되는 헨리 영 제임스는 이 사건을 조사하면서 헨리를 지하 감방에 가두게 한 진짜 장본인은 교도소 부소장 글렌Warden Glenn 게리 올드먼 분이라는 것을 알게 된다 그리고 그 뒤에는 앨카트래스와 연방정부라는 거대한 권력이 도사리고 있었다  한편 제임스의 애인이며 여성 변호사인 매리Mary McCasslin 엠베스 데이비츠 분는 법조인으로 전도 유망한 제임스의 장래가 걱정이 되어 그를 이 사건에서 보호하려고 애를 쓰다 재판은 크로슨 판사Clawson R 리 에어미 분가 맡게 되고 제임스는 형 바이론Byron Stamphill 브래드 듀리프 분의 반대가 심해지는데  {알카트레즈Alcatraz는 1963년에 영원히 폐쇄됐다 오늘날 알카트라즈는 최대의 관광 명소로 각광받고 있으며 100만이 넘는 관광객들로 매년 붐비고 있다},드라마
95,우리들의 일그러진 영웅,40대의 한병태는 회사를 그만 두고 시작한 지 1년 된 학원 강사다 사회 속의 권력 암투에 적응하지 못하고 폐쇄된 학원 공간에서 소극적인 삶을 살아가는 병태에게 어느날 국민학교 동창생인 황영수로부터 최선생신구 분의 부음 소식을 듣는다 그런 그에게 엄석대 급장이 온다는 소식이 그를 최선생 상가집으로 발걸음을 옮기게 한다 그는 이제 30년전 5학년 2반을 회상하며 기차속에서 과거의 여행을 시작한다 30년 전의 그때 한병태고정일 분는 서울의 명문 국민학교에서 소도시의 운천 국민학교로 전학을 간다 자유당 정권이 기승을 부리던 당시 공무원이었다가 그곳까지 전근을 가게 된 아버지를 따라 병태의 가족 모두가 이사를 가게 된 것이다  화려했던 서울에 비해 소도시의 국민학교는 초라할 뿐이다 우월함을 뽐내고 싶었던 병태는 담임 최선생이나 반 아이들의 무관심 속에 내팽게쳐진다 또한 엄석대홍경인 분라는 급장은 병태의 가치관을 흔들어버리는 존재로 다가온다 석대는 선생님과 같은 위치를 차지하며 반 아이들의 절대적인 맹종을 받고 있다 그런 급장으로 인해 모든 사람은 평등하다고 믿는 병태에게는 옳지 못한 존재였다 병태는 석대를 이겨야만 모든 것이 원상 회복 될 것으로 여기며 석대에게 대항한다 그러나 이러한 병태의 태도에 대하여 석대의 보이지 않는 힘의 압력은 병태를 고되고 힘든 시련의 시기로 내몰 뿐이다 여러가지로 대항하던 중 최후의 수단인 공부로 석대를 누르려하나 역시 석대의 그늘을 벗어나진 못한다 병태는 점점 성적도 떨어지고 운천 국민학교의 말썽꾸러기로 선생님 둘의 눈총을 받게 된다 이런 나날들이 계속될 무렵 유리창 청소 사건을 계기로 병태는 석대의 권력 아래로 편입하게 된다 그리고 쏟아지는 석대의 총애는 병태를 권력의 단맛으로 길들이기에 충분했다 그러나 석대의 성적이 진짜 실력이 아닌 타인의 것이라는 사실을 알고 다시 한번 시도하고 싶어 기회를 엿본다 그렇지만 석대의 미포리행 제안으로 병태는 석대 왕국의 충복으로 남게 된다  1960년 새학년이 시작되면서 김정원최민식 분이라는 젊고 유능한 선생님이 부임한다 김선생은 아이들에게 정직 진실 용기에 대한 신념을 심어주려 노력한다 김선생은 석대의 위치를 눈치채고 모두 똑같은 친구임을 강조한다 석대 역시 김선생이 자신을 의심하는 것을 느끼면서도 지금까지 세워온 왕국을 고수할 수 밖에 없는 딜레마에 빠져버린다 결국 김선생은 석대의 시험지 바꿔쓰기를 발견 처벌하고 이에 반 아이들은 모두 석대의 비행을 늘어놓지만 병태만은 모른다고 대답한다 석대는 그 상황을 견디지 못하고 학교를 뛰쳐나간 뒤 밤에 교실에 불을 지르고 다시는 돌아오지 않았다 시간이 흐르면서 병태는 점점 안정의 길을 걷게 된다 병태는 다시 서울로 전학을 가고 세월이 지나 대학을 졸업하며 사회에 나온다 석대는 어디선가 틀림없이 다시 급장이 되서 또다른 반을 자신의 의지대로 움직이고 있으리라는 생각이 병태의 뇌리를 스친다 30년전의 석대가 떠오른다 몰락한 영웅의 초라하고 무력한 우리둘 중의 하나가,드라마
96,에이 아이,과학문명은 천문학적 속도로 발전하고 있지만 극지방의 해빙으로 도시들은 물에 잠기고 천연자원은 고갈되어 가던 미래의 지구 모든 생활을 감시받고 먹는 음식조차 통제되는 그 세계에서 인간들은 인공지능 Artificial Intelligence을 가진 인조인간들의 봉사를 받으며 살아간다 정원가꾸기 집안 일 말 동무등 로봇이 인간을 위해 해줄수 있는 일은 무한하다 단 한가지 사랑만 빼고로봇에게 감정을 주입시키는 것은 로봇공학 발전의 마지막 관문이자 논란의 쟁점이기도 했다 인간들은 로봇을 정교한 가재 도구로 여길 뿐 그 이상의 것을 용납하지 않았다 그러나 많은 부부가 자식을 가질 수 없게 되면서 인간들은 로봇에게서 가재 도구 이상의 가치를 찾게 된다 어느날 하비 박사는 감정이 있는 로봇을 만들겠다고 선언한다 하비 박사의 계획에 따라 로봇 회사 Cybertronics Manufacturing을 통해 감정을 가진 최초의 인조인간 데이빗이 탄생하고 데이빗은 Cybertronics사의 한 직원 헨리 스윈튼의 집에 입양된다인간을 사랑하게끔 프로그래밍된 최초의 로봇 소년 데이빗 스윈튼 부부의 친아들 마틴은 불치병에 걸려 치료약이 개발될 때까지 냉동된 상태다 데이빗은 그들 부부의 아들 역할을 하며 인간사회에 적응해간다 스윈튼 부부를 부모로 여기던 데이빗은 마틴이 퇴원하면서 버려지고 만다 엄마가 들려준 피노키오 동화를 떠올리며 진짜 인간이 되어 잃어버린 엄마의 사랑을 되찾을 수 있다고 생각하는 데이빗은 자신의 장난감이자 친구이며 보호자인 테디 베어를 데리고 여행을 떠난다 도중에 만난 남창 로봇 지골로 조가 데이빗과 동행하고 두 사이보그는 힘겨운 여정을 거치며 수몰된 맨하탄까지 찾아가지만,SF
97,프리 윌리,12살의 제시는 어머니로부터 버림을 받은 후 거리에서 방황하며 살아가는 소년이었다 거리에서 좀도둑질을 하며 경찰서를 제집드나들듯 드나드는 제시는 어느날 마을에 있는 수족관에 들어가 친구와 벽에 낙서를 한게 발각되어 두달동안 수족관 청소를 해야하는 벌을 받게 된다 제시는 지금까지 소년 보호원에 안가는 대신 벌로 각종 궂은 일을 해야했지만 이번엔 하루종일 수족관의 유리와 벽을 닦는 일을 하게 된 것이다 그러나 제시는 이곳에서 뜻하지 않은 우정을 발견하게 된다 바로 이 수족관의 최고의 스타이자 신비에 싸인 고래 윌리  7000 파운드가 넘는 고래 윌리는 이 수족관의 어떤 조련사의 말도 듣지 않고 고래쇼에 나가서 재주부리는 걸 거부하는등 수족관에서 가장 큰 골치덩어리인 고래였다 제시는 이 거대한 모든 것을 거부하는 윌리에게 큰 흥미를 느낀다 제시의 계속되는 사랑에 윌리 또한 누구에게도 보인 적이 없었던 신뢰를 제시에게 보이고 둘은 비록 동물과 사람이라는 장벽이 있었지만 뗄레야 뗄 수 없는 애정을 서로에게 느끼게 된다 제시가 기대하지 못한 것은 동물 조련사 레린들리로리 페티 분와 잡역부 랜돌프 존슨어거스트 슐런버그 분를 친구로 사귀는 것이었다 그리고 특히나 공원의 악명높고 비사교적인 거주자 윌리와 친구가 되리라고는 제시가 윌리와 의사소통의 방법을 배우고 윌리에게서 믿음과 우정을 얻게 되면서 그리고 그 웅장한 고래가 지느러미를 돌려 구르고 다이빙을 하고 도약을 하는 등의 감탄할 만한 행동의 연속으로 답하면서 상호신뢰와 애정의 유대감이 두 부적응자 사이에 서서히 발전한다  그러나 다이얼과 웨이드가 그 장엄한 동물에 대해 무서운 계획을 꾸미고 있음을 발견했을 때 제시는 그의 앞에 단 한가지 선택이 남아있음을 깨닫는다 윌리를 본래의 윌리의 모습으로 프리윌리가 되게 하는 것이 제시가 할 수 있는 유일한 일이었다 자신이 소년원에 가게 될지도 몰랐지만 제시는 모든 것을 걸고 윌리를 풀어준다 진정한 우정을 발견하면서 제시는 전에 거칠고 반항적이었던 자신의 마음에 따스한 사랑이 일어남을 느낀다,가족
98,시네마 천국,유명 영화감독으로 활약 중인 토토자크 페렝는 고향 마을의 영사기사 알프레도필립 느와레의 사망소식에 30년 만에 고향을 찾는다 어린 시절 영화가 세상의 전부였던 소년 토토살바토레 카스치오는 학교 수업을 마치면 마을 광장에 있는 낡은 시네마천국이라는 극장으로 달려가 영사 기사 알프레도와 친구로 지내며 어깨너머로 영사기술을 배운다 어느 날 관객들을 위해 광장에서 야외 상영을 해주던 알프레도가 그만 화재 사고로 실명하게 되고 토토가 그의 뒤를 이어 시네마천국의 영상기사로 일하게 된다 실명한 후에도 토토의 친구이자 아버지로 든든한 정신적 지주가 되어준 알프레도는 청년이 된 토토마코 레오나디가 사랑하는 여자 엘레나아그네즈 나노의 부모님의 반대로 좌절하자 넓은 세상으로 나가서 더 많은 것을 배우라며 권유하고 토토는 고향을 떠나게 되는데,드라마
99,뷰티풀 투모로우,박효신 7집 〈I am A Dreamer〉를 새롭게 만나는 시간아티스트 박효신이 전하는 꿈의 메시지 뷰티풀 투모로우2016년 10월 6년만의 정규 앨범 7집 〈I am A Dreamer〉로 돌아온 박효신 그가 음악적 소울메이트인 정재일과 함께 쿠바로 떠나 자유롭게 음악작업을 하며7집 앨범을 완성해가는 모습을 고스란히 만나볼 수 있는 블럭 뮤직비디오다 낯설지만 아름다운 쿠바의 소극장 길거리 바다를 무대로자유롭게 노래하는 박효신과 정재일 그리고 쿠바 소년 라파엘의 모습이7집 앨범 수록곡과 함께 아름답게 펼쳐진다 대표곡 숨 Beautiful Tomorrow Home은 물론이전 영상으로 공개되지 않았던 Im a dreamer Wonderland LiLa를 포함해 총 9곡을 박효신의 감미로운 내레이션과 함께 한 편의 영상으로 감상할 수 있다 낯선 풍경 속에서 새롭게 들리는 나의 노래 그리고 노래하며 다시 행복한 나Beautiful Tomorrow,드라마
100,오세암,눈을 감은 소녀 감이와 다섯 살 길손이에겐 서로가 세상의 전부다 엄마의 기억이 없는 길손이의 평생 소원은 한번이라도 엄마를 가져 보는 것 둘은 어디 있는지 모를 엄마를 찾기 위한 여행을 떠난다 그리고 막 추운 겨울이 시작되려는 즈음 한 마을에서 머리에 머리카락씨만 뿌려진 설정 스님을 만난다  아저씨 이름이 스님이야 참 재밌는 이름이네 스님을 스님 아저씨라 부르며 절집 생활을 시작하게된 두꼬마 그러나 순진 발랄이 도를 넘어 엽기적이기까지 한 길손이는 순식간에 조용한 절집을 뒤집어버린다 이불에 오줌싸는 일은 사흘에 한번 꼴 조용해야할 선방으로 날짐승을 몰아와 우당탕거리는 일은 이틀에 한번 꼴 법회때 한가운데 앉아있다 방귀를 뽕 소리가 나게 뀌질 않나 법회중인 스님들 신발을 몽창 가져다 나무에 달아놓지를 않나 바람 소리와 풍경소리가 전부이던 조용한 절이 순식간에 길손이의 활기로 가득 찬다  그러나 밝음 그자체인 것 같은 길손이에게도 밖으로 내보이지 못하는 슬픈 소원이 하나 있다 한번이라도 엄마를 가져 보는 것 엄마라고 큰 소리로 마음껏 불러 보는 것 길손이는 설정 스님을 따라 겨우내 작은 암자에서 마음의 눈을 뜨는 공부를 하기로 한다 정말 마음의 눈을 뜨면 엄마를 볼 수 있을까 마음을 다해 부르면 엄마가 내게 와줄까 설정 스님이 마을로 내려가 길손이 혼자 암자에 남은 어느 밤 한바탕 하얀 폭설이 온 산하와 암자를 가득 덮은 그 밤 암자에서 혼자 잠든 길손이는 자신을 품에 안고 정성스럽게 토닥거려주는 손길을 느낀다 이런 따뜻함이 엄마의 품일까 지금 눈을 뜨면 엄마를 볼 수 있을까 {오세암은 본래 백담사의 부속 암자로서 관음암이라 하였다 다섯 살 난 아이의 성불을 기리기 위해 암자를 중건하고 오세암으로 이름을 바꾸었다},애니메이션
101,다이 하드,크리스마스를 보내기 위해 아내와 자식이 있는 로스엔젤레스로 날아온 뉴욕 경찰 존 맥크레인브루스 윌리스 분 그가 아내 홀리보니 델리아 분의 직장이 있는 나카토이 빌딩으로 찾아 갔을 때 사무실에서는 크리스마스 파티가 한창이다 그러나 파티가 한창 무르익을 무렵 한스 그루버Hans Gruber 알란 릭맨 분가 이끄는 일단의 테러리스트들이 침입 사장을 비롯한 파티 참석자 30여 명을 인질로 삼고 건물 금고에 소장하고 있는 돈과 보물을 손에 넣으려 한다  최첨단 하이테크에 의해 관리되던 34층짜리 나카토미 빌딩은 통채로 테러리스트들의 수중으로 넘어가 폐쇄되고 고층 빌딩은 살벌한 생존 게임의 전쟁터로 변해 가공할 병기가 복도를 휘젖는다 긴급 출동한 경찰과 FBI는 혼자 고군분투하는 존을 무시한 채 멋대로 무리한 작전을 수행한다 뿐만 아니라 출세욕에 눈이 먼 TV 리포터는 앞뒤없이 카메라를 들이대어 맥클레인을 궁지로 몰아 넣는다 다만 말단 흑인 경찰관 포웰 경사레지날드 볼존슨 분만이 그의 눈과 귀가 되어 줄 뿐이다 맥클레인은 초인적인 힘을 발휘하여 최첨단 장비로 무장된 12명의 테러리스트들을 한명씩 처치해 간다,액션
102,폴리스 스토리,홍콩 경찰청의 특수기동대 소속 진가구 순경성룡은 낙천적인 성격과 뛰어난 능력으로 모든 사람들로부터 인기가 높다 특수 기동대 훈련을 마치고 본서로 돌아온 진가구는 동료들과 함께 악명 높은 마약밀매 조직인 구탐파 일당을 일망 타진하는 작전에 투입되어 범죄자들과 일대 격전을 벌인 끝에 두목인 구탐을 혼자서 체포하여 일약 경찰의 영웅이 된다 서장은 부족한 증거를 보완하기 위해 구탐의 여비서인 셀리나를 무혐의 처리해 주는 대신 법정에서 구탐의 혐의를 입증해 줄 수 있는 증언을 해 줄 것을 요청하고 구탐의 부하들이 셀리나를 해치지 못하도록 재판이 열릴 때까지 보호하는 임무를 진가구에게 맡긴다 그러나 증언을 탐탁찮게 여기는 셀리나는 진가구의 녹음기에 장난을 쳐놓은 뒤 달아나 버리고 셀리나 없이 재판정에 나간 진가구는 증언대에서 대망신만 당한다 그 일로 구탐은 풀려나고 진가구는 징계를 받는다 그러나 진가구는 이에 굴하지 않고 셀리나의 행방을 찾지만 구탐의 부하들의 함정에 빠져 셀리나를 구해내는 데엔 성공하나 대신 구탐의 끄나풀 노릇을 한 모순경을 죽인 살인범으로 누명을 쓰고 쫓기게 된다 그러나 진가구는 포기하지 않고 구탐의 주위를 맴돌다가 자료를 내려던 셀리나를 잡으러 온 그들의 일당과 대격투를 벌여 마침내 구탐과 그 일당을 체포하고 셀리나의 도움으로 누명도 멋고 구탐의 범죄를 입증할 증거까지 함께 확보한다,액션
103,타잔,배가 난파되자 젊은 부부와 어린 아기인 타잔은 야수들이 들끓는 정글에 가까스로 도착한다 그후 얼마 뒤 표범에게 새끼 고릴라를 잃은 칼라Kala 글렌 클로즈 목소리 분가 밀림 속에 버려진 아기를 발견한다 아기의 부모는 이미 표범에게 잡아 먹힌 뒤였다 표범의 위협으로부터 아기를 극적으로 살려낸 칼라는 고릴라의 지도자인 커착Kerchak 랜스 헨릭슨목소리 분에게 아기를 데려간다  5살배기가 된 타잔Young Tarzan 알렉스 D 린즈목소리 분은 장난꾸러기이다 고릴라들 속에서 고릴라가 된 타잔은 밀림의 동물을 흉내내고 따라하지만 동물 친구들에 비해 자신이 어딘가 다르다는 것을 깨닫기 시작한다 청년으로 성장한 타잔Tarzan 토니 골드윈목소리 분은 이제 날렵하고 강인한 타잔으로 변신했다 칼라의 새끼 고릴라와 타잔의 부모를 죽인 표범이 나타나자 타잔은 일대 일로 붙어보잔듯 실력을 발휘한다 엄격한 지도자인 커착 또한 타잔의 비상한 두뇌와 날렵한 동작 그리고 가족을 위해 목숨을 던질만큼 굴하지 않는 용기에 감탄을 금치 못한다  이 무렵 정글에 총성이 울려 퍼진다 타잔의 운명에 위기와 변화가 닥칠 것이란 신호탄같은 총성이었다 총성의 진원지를 찾아간 타잔은 태어나서 처음으로 인간을 만나게 된다 고릴라를 연구하기 위하여 온 포터 교수Professor Archimedes Q Porter 니젤 호손목소리 분 그의 아름다운 딸 제인Jane Porter 미니 드라이버목소리 분 그리고 두 사람의 안내자 자격으로 동행한 클레이튼Clayton 브라이언 브레시드목소리 분을 만난 타잔은 또 다른 세계가 존재한다는 것을 깨우치게 된다 게다가 타잔은 자신이 제인에게 이끌리고 있다는 것을 느끼기 시작한다 그러나 타잔은 인간과 일체감을 느끼기 시작하면서 자신에게는 물론 고릴라 가족에게 비극적인 위기가 닥치게 될 것이란 사실을 의심조차 하지 못한 채 인간을 밀림속으로 이끄는데,애니메이션
104,"미안해요, 리키",넉넉하지는 않지만 누구보다 행복한 가장 리키안정적인 생활을 꿈꾸며 택배 회사에 취직하지만생각과는 다른 일상이 전개되고 화목했던 가족은 뜻밖의 난관에 부딪히는데 성실하게 행복을 찾고 싶었던 리키의 우리의 이야기가 찾아온다,드라마
105,록키,필라델피아 뒷골목 4회전 복서 록키 고리대금 업자의 하수인 노릇으로 생계를 이어가던 그는 짝사랑 하던 여인 에이드리언과 연인이 되며 새로운 미래를 꿈꾼다 그러던 어느 날 세계 챔피언 아폴로 크리드가 미국 독립 200주년을 기념해 무명의 복서에게 도전권을 주는 이벤트를 준비하고 그 상대로 록키가 지목 되는데,드라마
