,title,story,genre
283,빽 투 더 퓨쳐 3,1955년에 남겨진 마티는 박사가 1885년으로 갔음을 알게 된다 그의 흔적을 찾아보니 드로리안은 폐광 속에 숨겨져 있었다 그러나 그가 비프토마스 F 윌슨 분의 선조인 매드독 태넌토마스 F 윌슨 분의 총에 맞아 죽었다고 쓰여진 비석을 발견하고는 박사를 구출하기 위해 위험한 시간 여행을 감행한다 1885년의 서부에 도착한 마티는 드로리안의 고장으로 맥플라이 가문의 선조인 세이머스마이클 J 폭스 분와 매기리 톰슨 분 부부의 도움을 받게 되고 박사도 만난다 고장 난 드로리안으로 시간 여행에 필요한 속도를 얻기위해서 기관차를 이용하려는 위험한 계획이 세워지지만 박사는 여교사인 클라라매리 스틴버겐 분와 사랑에 빠져서 그 시대에 남고 싶어하고 원래 박사가 당하게 되어있던 매드독 태넌과의 결투를 마티가 떠맡게되는 사건이 발생한다 마티는 기지를 발휘해 매드독과의 결투에서 이기고 기관차는 질주하기 시작한다 박사는 자기를 쫓아온 클라라와 남기로 결심을 하고 마티는 그들과 작별 인사를 한 후 무사히 1985년으로 돌아온다 드로리안은 완전히 파괴되고 인간적으로 성숙해진 마티 앞에 새로운 타임머신을 가지고 박사가 다시 나타난다 그리고 말한다 미래는 백지야 자네가 직접 만드는 것이라네 멋진 인생을,SF
284,철가방 우수氏,고아로 자라 가난과 분노로 얼룩진 삶을 살아 온 우수의 인생은 마치 좁고 어두운 감방과도 같이 헤어날 수 없을 것만 같았다 그러나 모든 것을 놓아버리려고 생각한 그때 가난한 사람도 누군가와 나눌 수 있음을 알게 해준 아이들과의 기적과도 같은 만남은 그의 삶을 송두리째 바꾸어 놓는다 우수는 중국집에서 철가방을 들고 뛰어다니면서 번 70만원의 월급을 아이들을 위해 아낌없이 나누었다 태어나서 누군가에게 처음으로 들어 본 감사하다는 인사는 평생 외로웠던 우수에게 세상 누구보다 행복한 나날을 선물했고 서로가 서로에게 전하는 뜨거운 감사는 이제 삶의 원동력이자 살아야 하는 이유가 되었다  그러던 어느날 우수가 교통사고를 당하게 되는데 우리가 미처 몰랐던 철가방 기부천사 우수의 뜨거운 인생 이야기가 이제 시작된다,드라마
285,공범자들,2008년 미국산 쇠고기 수입문제 보도로 MB정부가 큰 타격을 입자 본격적인 언론 장악이 시작된다 첫 타겟이 된 KBS가 권력에 의해 점차 무너지고 2010년 4대강 사업의 실체를 고발한 MBC 도 점령당한다 결국 방송 검열이라는 최악의 상황으로 치닫으면서 더 이상 공영방송이 아닌 권력의 홍보 기지로 전락한 KBS와 MBC 2014년 세월호 참사의 오보와 2016년 최순실 국정농단 사건의 진실마저 은폐하려 한다 최승호 감독은 지난 10년 동안 공영방송을 망친 주범과 그들과 손잡은 공범자들의 실체를 밝히기 위해 다시 한 번 움직이기 시작하는데,다큐멘터리
286,다키스트 아워,우린 결코 굴복하지 않습니다승리가 없으면 생존도 없기 때문입니다덩케르크 작전 그 시작다키스트 아워,드라마
287,분노의 질주: 더 세븐,거대 범죄 조직을 소탕한 뒤 전과를 사면 받고 평범한 일상을 되찾은 도미닉빈 디젤과 멤버들하지만 평화도 잠시 한성 강의 갑작스러운 죽음에 이어 도미닉의 집이 순식간에 폭파당한다그들을 차례대로 제거하려는 최악의 상대 데카드 쇼제이슨 스타뎀의 등장으로도미닉은 다시 한 번 역대 최강의 멤버들을 불러모아 숨막히는 반격을 결심하는데,액션
288,혐오스런 마츠코의 일생,도쿄에서 백수 생활을 하던 쇼에이타는 고향의 아버지카가와 테루유키로부터 한 통의 전화를 받는다 행방불명 되었던 고모 마츠코나카타니 미키가 사체로 발견되었으니 유품을 정리하라는 것 다 허물어져가는 아파트에서 이웃들에게 혐오스런 마츠코 라고 불리며 살던 그녀의 물건을 정리하며 쇼는 한 번도 만난 적 없는 마츠코의 일생을 접하게 된다 중학교 교사로 일하며 모든 이에게 사랑받던 마츠코에게 지난 25년간 도대체 어떤 일이 일어난 것일까 제자가 일으킨 절도사건으로 해고 당한 마츠코는 가출을 감행한다 하지만 동거하던 작가 지망생은 자살해 버리고 그의 친구와 불륜을 시작한 마츠코는 곧 버림받고 절망에 빠져 몸을 팔게 된다 기둥서방에게마저 배신당한 마츠코는 그를 살해 8년형을 언도 받는다 출소 후 미용사로 일하던 마츠코는 자신을 해고당하게 만들었던 절도사건의 범인인 제자 류 요이치와 재회하고 운명적인 사랑에 빠지게 되는데,코미디
289,호로비츠를 위하여,호로비츠 같이 위대한 피아니스트가 되고 싶었지만 부족한 재능 탓에 변두리 피아노 학원 선생을 하고 있는 김지수 학원으로 이사오던 날 메트로놈을 훔쳐 달아나는 이상한 아이 경민을 만나게 된다  그러던 어느날 우연히 경민이가 절대음감을 가진 천재소년이라는 것을 알고 눈이 번쩍 뜨인 지수 경민이를 유명한 콩쿠르에 입상시켜 유능한 선생님으로 명성을 떨치고자 열심히 훈련에 매진한다  마침내 콩쿨날을 맞이하는 그들  따라올 자 없는 경민이의 실력에 지수는 한껏 의기양양하다 그러나 무대에 선 경민이는 어쩐일인지 꼼짝도 하지 않고 좌절한 지수는 경민을 매몰차게 내모는데,드라마
290,이터널 선샤인,조엘은 아픈 기억만을 지워준다는 라쿠나사를 찾아가 헤어진 연인 클레멘타인의 기억을 지우기로 결심한다 기억이 사라져 갈수록 조엘은 사랑이 시작되던 순간 행복한 기억들 가슴 속에 각인된 추억들을 지우기 싫어지기만 하는데 당신을 지우면 이 아픔도 사라질까요 사랑은 그렇게 다시 기억된다,멜로/로맨스
291,빅 히어로,천재 공학도 테디가 개발한 힐링로봇 베이맥스테디의 동생이자 로봇 전문가인 히로는 도시가 파괴될 위기에 처하자 베이맥스를 슈퍼히어로로 업그레이드 하는데과연 이들은 도시의 위험을 막아낼 수 있을까,애니메이션
292,싸이코,회사원인 마리오쟈넷 리 분는 그녀의 애인 샘존 개빈 분과 결혼하길 원하지만 샘은 빚을 갚을 때까지 기다리라고 말한다 그래서 그녀는 자신이 다니고 있는 회사 사장이 은행에 입금하라고 맡긴 돈을 들고 도망친다 돈을 가지고 샘을 만나러 떠난 그녀는 도주 첫날 밤 도로변에 있는 낡은 모텔에 묵게 된다 모텔의 주인인 노만 베이츠앤소니 퍼킨스는 그녀에게 친절하게 대해주며 자신은 모텔 바로 뒤쪽 빅토리아풍의 큰 저택에서 몸이 불편한 어머니와 함께 살고 있다고 말한다 잠자리에 들기 전 마리온이 샤워를 하는 도중 난데없이 검은 형상이 욕실에 나타나고 마리온은 실종된다 실종된 마리온을 찾기 위해 그녀의 언니 릴라와 샘 그리고 보험회사 측에서 고용한 탐정인 아보가스트 등 세 사람이 추적에 나선다 아보가스트는 조사 끝에 그녀가 머물렀던 모텔을 찾게 되는데,공포
293,하울의 움직이는 성,어느 날 영문도 모른 채 마녀의 저주로 인해 할머니가 된 소녀 소피 절망 속에서 길을 걷다가 거대한 마법의 성에 들어가게 된다  그곳에서 자신과 마법사 하울의 계약을 깨주면 저주를 풀어주겠다는  불꽃악마 캘시퍼의 제안을 받고 청소부가 되어 움직이는 성에 머물게 되는데,애니메이션
294,패딩턴 2,런던 생활 3년 차 현지 적응 완료한 패딩턴은  이발소 보조 아쿠아리움 청소 창문 닦기까지 섭렵 자칭 알바 마스터로 거듭난다  루시 숙모의 100번째 생일 선물 비밀의 팝업북을 사기 위해 한 땀 한 땀 돈을 모으던 패딩턴에게 닥친 곰생 최대 위기 변장의 대가 피닉스에 의해 비밀의 팝업북 도둑 누명을 쓰고 감옥에 갇히게 된 것 그러나 이대로 물러설 수는 없다 새로운 감옥 친구들과 브라운 가족의 도움으로 탈출을 감행 진짜 범인 피닉스를 찾기 위한 털 날리는 추격을 시작하는데,코미디
295,짱구는 못말려 극장판: 정면승부! 로봇아빠의 역습,어느 날 로봇이 되어 돌아온 짱구 아빠 짱구는 그 동안 영화에서만 봤던 슈퍼히어로가 되어 특별한 능력을 보여주는 로봇 아빠가 자랑스럽다 그러나 갑자기 무시무시한 모습으로 변하는 로봇 아빠와 함께 떡잎마을을 무너뜨리려는 거대한 음모가 드러나는데  과연 로봇 아빠와 짱구 가족은 마을의 평화를 지켜낼 수 있을까,애니메이션
296,웨딩 드레스,미안해 우리 아가 엄마가 먼저 가서 너무 미안해 세상에서 젤 예쁜 내 보물 소라 엄마는 소라에게 해주고 싶은 게 너무 많아 우리 소라 좋아하는 게임기 장난감도 많이 많이 사주고 싶어 비 오는 날 우산 잊고 가도 젖지 않게 엄마가 데리러 갈게 친구랑 싸우면 엄마가 멋있는 생일파티 열어줄 테니 화해해 멋지게 발레 하는 우리 소라 공연도 찾아가고 소풍 가는 날 세상에서 제일 맛있는 김밥도 싸줄게 해주고 싶은 건 너무 많은데 시간이 너무 없다 그래도 엄마가 제일 잘하고 꼭 주고 싶었던 한 가지는 해주고 싶어 소라를 위해 엄마가 만든 세상에 단 하나뿐인 웨딩드레스 이 드레스 입은 우리 딸 꼭 보고 싶었는데 세상에서 가장 아름다운 신부가 될 우리 소라랑 함께하지 못해서 엄마가 너무 미안해 사랑한다 소라야,드라마
297,드래곤볼 슈퍼: 브로리,힘의 대회 후 평화를 되찾은 지구그리고 더욱 강해지기 위해 수행에 몰두하고 있는 오공과 베지터 앞에 나타난 것은 지금까지의 그 어떤 적보다 강한 사이어인 브로리엄청난 전투력으로 오공과 베지터를 무기력하게 만드는 브로리와 또 다시 지옥에서 돌아온 프리저까지 뒤얽혀 서로 다른 운명을 살아온 세 사이어인들은 처절한 전투를 시작하고오공과 베지터는 최후의 선택으로 본인들의 한계를 뛰어넘는 퓨전을 시도하는데,애니메이션
298,정무문,정무문의 창시자이자 태극권의 사부인 허영가의 사망 소식을 들은 첸이소룡은 사부의 주검 앞에서 세상을 잃은 듯 오열 한다 사부의 죽음에 수 많은 의심을 품은 첸은 복수를 위해 첫 번째로 홍백파의 도장으로 찾아가 그 동안 사부에게 배워왔던 모든 기술을 이용해 어디서도 보지 못한 현란한 발차기와 쌍절곤으로 수십명의 관원들을 단숨에 쓰러뜨린다 상해로 떠나기로 결심하던 날 사부를 독살한 범인을 알아낸 첸은 최후의 복수를 다짐하는데,액션
299,무간도,경찰의 스파이가 된 범죄 조직원범죄 조직의 스파이가 된 경찰한번의 선택으로 인생이 바뀌어버린 두 남자의 피할 수 없는 만남,범죄
300,클리프행어,록키 산악 공원 구조 대원으로 일하던 게이브는 조난 당한 동료 핼의 연인 새라를 구조하다가 죽인데 가책을 느끼고 사랑하는 동료 구조원 졔스 곁을 떠난다 일년 후 덴버에서 자리잡은 게이브는 졔스를 데릴러 산으로 돌아온다 아직도 친구 연인을 죽게했다고 괴로워 하지만 산을 보는 순간 뜨거운 정을 느끼지 않을 수 없었다 그러나 졔스는 게이브를 따라 산을 떠나지 않겠다고 거절한다 하는 수 없이 게이브는 혼자 덴버로 돌아간다 그러나 게이브가 떠나기 직전 폭풍우가 몰아치는 산에서 조난자가 구조를 요청 해온다 헬기는 뜰 수 없는 날이었다  게이브가 떠난 후 유일하게 산을 지키던 핼 혼자 보내기엔 일기가 너무 나빠서 졔스는 게이브에게 동행을 요청하지만 게이브는 이를 거절하고 떠난다 막상 산을 등지고 가던 게이브지만 혼자 애먹을 핼을 생각하며 차를 돌려 산으로 돌아간다 중간에서 핼을 만나 정상에 오른 게이브는 조난자라는 것이 사실은 운반 중인 금고를 중간에서 가로채어 국외 탈출을 시도하다 불시착한 내무성 요원들이라는 사실을 알고 아연 질색한다 인질이 된 둘은 그들의 돈가방을 찾는데 길잡이로 이용된다 당할 수만은 없다는 생각에 손바닥 같이 환한 지리를 이용해서 둘은 테러리스트들을 하나씩 헤치우면서 마침내 그들을 전멸시키고 안도의 숨을 돌린다 새라의 죽음을 게이브에게만 돌리던 핼도 마침내 눈을 떠 사리를 합리적으로 받아들여 다시 게이브의 손을 굳게 잡는다,액션
301,봄날은 간다,사운드 엔지니어 상우유지태 분는 치매에 걸린 할머니백성희 분와젊은 시절 상처한 한 아버지박인환 분 고모신신애 분와 함께 살고 있다어느 겨울 그는 지방 방송국 라디오 PD 은수이영애 분를 만난다자연의 소리를 채집해 틀어주는 라디오 프로그램을 준비하는 은수는 상우와 녹음 여행을 떠난다자연스레 가까워지는 두 사람은 어느 날 은수의 아파트에서 밤을 보낸다너무 쉽게 사랑에 빠진 두 사람 상우는 주체할 수 없을 정도로 그녀에게 빨려든다그러나 겨울에 만난 두 사람의 관계는 봄을 지나 여름을 맞이하면서 삐걱거린다이혼 경험이 있는 은수는 상우에게 결혼할 생각이 없다며 부담스러운 표정을 내비친다어떻게 사랑이 변하니라고 묻는 상우에게 은수는 그저 헤어져 라고 단호하게 말한다영원히 변할 것 같지 않던 사랑이 변하고 그 사실을 받아들이지 못하는 상우는 어찌 할 바를 모른다은수를 잊지 못하는 상우는 미련과 집착의 감정을 이기지 못하고 서울과 강릉을 오간다,드라마
302,말모이,1940년대 우리말이 점점 사라져가고 있는 경성 극장에서 해고된 후 아들 학비 때문에 가방을 훔치다 실패한 판수 하필 면접 보러 간 조선어학회 대표가 가방 주인 정환이다 사전 만드는데 전과자에다 까막눈이라니 그러나 판수를 반기는 회원들에 밀려 정환은 읽고 쓰기를 떼는 조건으로 그를 받아들인다 돈도 아닌 말을 대체 왜 모으나 싶었던 판수는 난생처음 글을 읽으며 우리말의 소중함에 눈뜨고 정환 또한 전국의 말을 모으는 말모이에 힘을 보태는 판수를 통해 우리의 소중함에 눈뜬다 얼마 남지 않은 시간 바짝 조여오는 일제의 감시를 피해 말모이를 끝내야 하는데  우리말이 금지된 시대 말과 마음이 모여 사전이 되다,드라마
303,인터스텔라,세계 각국의 정부와 경제가 완전히 붕괴된 미래가 다가온다  지난 20세기에 범한 잘못이 전 세계적인 식량 부족을 불러왔고 NASA도 해체되었다  이때 시공간에 불가사의한 틈이 열리고 남은 자들에게는 이 곳을 탐험해 인류를 구해야 하는 임무가 지워진다 사랑하는 가족들을 뒤로 한 채 인류라는 더 큰 가족을 위해 그들은 이제 희망을 찾아 우주로 간다 그리고 우린 답을 찾을 것이다 늘 그랬듯이,SF
304,블랙 호크 다운,{죽은 자만이 전쟁의 끝을 본다Only The Dead Have Seen The End of War  플라톤Plato}  {1992년 동아프리카 소말리아 몇년 동안의 부족간 전쟁은 대기근을 가져왔고 그로인해 30만여 명이 굶어죽었다 수도 모가디슈Mogadishu의 통치자인 강력한 군벌 모하메드 파라 아이디드Mohamed Farrah Aidid는 각국에서 보내온 구호물자들을 빼앗았고 굶주림은 그의 무기였다 세계가 이에 대응하여 미해병대 2만여 명의 병력을 투입시키자 식량은 제대로 전달되고 상황이 호전되는 듯 했다 1993년 4월 미해병대가 철수하자 아이디드는 곧바로 남아있던 UN 평화유지군에게 전쟁을 선포한다 6월 아이디드의 민병대는 24명의 파키스탄군 병사들을 사살하고 미군에게도 공격을 시작했다 늦은 8월 미국의 특수부대인 델타포스Delta Force 레인저Army Rangers 그리고 160 특수비행단160th SOAR 등이 아이디드를 체포하고 평화를 되찾는 임무를 받고 모가디슈로 보내진다 원래 3주예정이었던 임무가 6주를 넘어서자 워싱턴에선 조바심이 나게 된다}  1993년 10월 최정상의 미군부대가 UN 평화유지작전의 일환으로 소말리아의 수도 모가디슈로 파견된다 그들의 임무는 소말리아를 황폐화시키고 있는 내란과 기근을 진압하기 위한 작전으로서 소말리아의 악독한 민군대장인 모하메드 파라 에이디드의 두 최고 부관을 납치하는 일이다 동 아프리카 전역에 걸친 기아는 UN에 의해 제공되는 구호 식량을 착취하는 에이디드와 같은 민병대장으로 인해 30만 명이라는 대량 사상자를 내었다 죽이기 위한 것이 아닌 다수의 생명을 살리려는 의지를 품고 소말리아에 도착한 미국의 정예부대 육군 중사 맷 에버스만조쉬 하트넷 분은 이상적인 젊은 유격군으로서 목표한 건물을 지키기 위해 할당받은 4지점 중 하나를 지휘하면서 자신의 용기와 의지를 시험받게 된다 군사 서기관이지만 항상 모험을 동경해왔던 유격군 특수병 그림스이완 맥그리거 분는 이번 전투를 통해 그의 오랜 희망이기도 했던 실제 전투상황을 경험하게 된다  작전은 10월 3일 오후 3시 42분에 시작하여 1시간 가량 소요될 예정이었으나 20분 간격으로 무적의 전투 헬리콥터인 블랙 호크 슈퍼 61과 슈퍼 64가 차례로 격추되면서 임무는 공격에서 구출과 생존으로 바뀌면서 절박한 국면을 맞이하게 된다 고립된 젊은 유격부대와 베테랑 델타 부대원들은 구조 호위대가 그들을 찾으러 올 때까지 18시간동안 폐허가 된 모가디슈의 한 구역에서 부상당한 채 갇혀있어야 했다 도시 전체는 미군이 완전무장된 소말리아 민병대로부터 공격을 받으면서 완전 쑥대밭이 된다 극도의 팽팽한 긴장감과 전우를 잃어버린 허탈감 속에서도 군인들 사이에선 서로간의 협조가 이루어지고 전우애와 인간애의 진정한 면모를 배우게 되는데  {이 사태에서 천명의 소말리아인이 죽었고 19명의 미군병사가 사망했다}  {델타 포스의 게리 고든Gary Gordon 랜디 슈거트Randy Shughart 중사는 월남전 이후 최초로 죽은 후에 명예훈장미 최고 무공훈장을 받게 되었다 마이크 듀란트는 11일간의 감금 후 풀려났다 2주후 대통령 클린턴은 델타포스와 레인저들을 소말리아에서 철수시켰다 소장 윌리엄 F 개리슨 장군Major General William F Garrison은 교전의 결과에 대해 전적으로 책임을 졌다 1996년 8월 2일 에이디드는 모가디슈에서 살해당했다 다음날 개리슨 장군도 퇴역했다},전쟁
305,로건,가까운 미래 능력을 잃어가는 로건울버린은  멕시코 국경 근처의 한 은신처에서 병든 프로페서 X를 돌보며 살아간다 세상으로부터 자신을 숨기며 살아가고자 했던 로건은 정체불명의 집단에게 쫓기는 돌연변이 소녀  로라를 만나게 되고 그녀를 지키기 위해 모든 것을 건 대결을 펼치게 되는데,액션
306,스타워즈 에피소드 5 - 제국의 역습,{아주 먼 옛날 은하계 저편에A long time ago in a galaxy far far away} {반란군Rebellion으로써는 암담한 시기 죽음의 별Death Star을 파괴하는 데는 성공하였지만 제국군Imperial은 반란군을 은하계 막다른 곳으로 몰아냈다 루크 스카이워커Luke Skywalker가 이끄는 자유의 투사Freedom Fighters들은 제국의 무서운 스타함대Starfleet을 피하여 얼음으로 뒤덮인 호스Hoth 행성에 새로운 비밀 기지를 마련했다 젊은 스카이워커를 찾으려고 혈안이 된 간악한 악의 군주Evil Lord 다스 베이더Darth Vader 총통은 우주의 구석 구석에 수천의 원격조종 탐색선Remote Probes을 보냈다} 비록 죽음의 별은 폭파시켰지만 수와 무기에 있어서 열세인 반란군은 제국군에게 밀려서 우주의 변방인 얼음의 혹성에서 재기의 기회를 노리고 있었다 정찰에 나섰다가 얼음속에 사는 괴물에게 납치되어 다시 구출되는 과정에서 루크는 제다이 기사단의 스승 요다를 찾아가 제다이 수업을 받으라는 지시를 받는다 스카이워커를 찾으려는 제국은 우주의 곳곳에 탐색 장치를 떨어뜨려놓는데 결국 얼음의 혹성이 제국에게 발각된다 마침내 거대한 다리로 걸어다니는 마치 불을 뿜는 공룡과 같은 스노우 워커를 앞세운 제국의 반격이 개시된다 우세한 제국에 밀린 반란군은 직결 지점에서 만나기로 하고 뿔뿔이 흩어진 채로 간신히 퇴각에 성공한다 루크는 제다이 기사이자 철학자이면서 8백살이 넘는 나이를 가진 요다가 있는 습지대의 혹성 다고바로 가서 그에게서 철저한 훈련을 받으며 제다이로서의 기량을 갖추고자 애쓴다 한편 자바를 찾아 떠나려다 실종되었던 루크를 구출하느라 머물고 있던 솔로는 레이아 공주가 기지에 갇히는 바람에 퇴각하는 수송선에 오르지 못하자 그녀를 데리고 겨우 팰콘에 오른다 하지만 미쳐 팰콘의 고속 추진기를 고치지못한 관계로 광속을 낼 수 없어 제국의 끈질긴 추적을 계속 받는다 제국의 추적에 위험이 계속되는 솔로 일행은 우주의 온갖 암석들이 밀집된 소혹성군Asteroid으로 들어가 뒤쫓아오는 제국의 추적기 4대 중 2대가 암석과 부딪쳐 폭발된다 그리고 다시 거대한 암석의 계곡으로 들어가 납작한 팰콘과 좁은 지형을 이용 뒤따라오던 나머지 두 대도 폭발시킨다 그리고 그 별의 구멍 속으로 피신한다 그곳에서 팰콘을 수리하지만 무언가 이상함을 느낀 솔로는 자신이 착륙한 곳이 바로 동굴에 사는 뱀처럼 생긴 거대한 우주 괴물의 입 속이었다 간신히 괴물에게서 탈출하지만 다시 끈질기게 암석들을 부수며 별무리속을 뚫고 쫓아오는 제국 함대의 공격을 받자 솔로는 기지를 발휘 함대에 뒷편에 붙어서 숨는다 그리고 그의 예상대로 함대가 광속 추진을 하기전 쓰레기를 버릴 때 함께 떨어져 나온다 함대는 광속으로 순간적으로 멀리 가고 솔로는 근처에 있는 옛 친구 랜도 칼리시안이 관리하는 구름의 도시를 찾아가는데,SF
307,아이덴티티,폭풍우가 몰아치는 어느 밤 네바다 주의 사막에 위치한 외딴 모텔에 10명의 사람들이 모여든다 리무진 운전사와 그가 태우고 가던 여배우 경찰과 그가 호송하던 살인범 라스베이거스 매춘부와 신혼부부 신경질적인 모텔 주인까지 포함한 총 11명 사나운 폭풍우로 길은 사방이 막혀버리고 사람들은 어둠과 폭우가 걷히기를 기다리지만 연락이 두절된 호텔에 갇힌 이들은 하나 둘씩 살해당하기 시작한다  죽음으로 시작된 살인의 그림자는 그들을 극도의 공포로 몰아간다 현장에 남겨진 것이라곤 모텔 룸 넘버 10이 적힌 열쇠뿐 연이은 죽음의 현장에는 987 카운트 다운을 알리는 열쇠만이 남아 끝나지 않은 살인을 예고하다 서로가 서로를 의심하는 가운데 모두가 기억하기 싫은 비밀이 서서히 베일을 벗는데,드라마
308,하치 이야기,대학교수인 파커 리차드 기어는 퇴근길 기차역 플랫폼에서 길 잃은 강아지를 발견하고 아내조안 알렌의 반대에도 불구하고 녀석을 극진히 보살피고 키운다 품종이 일본의 아키타견인데 착안해 하치라는 이름을 얻게 되고 하치는 주인을 따라 아침이면 출근길을 배웅하고 저녁이면 그 기차역에서 주인을 마중하기를 하루도 거르지 않는다 그런 녀석이 너무도 사랑스러운 파커 교수 그러나 어느날 파커가 강단에서 강연 중 쓰러지고 하치는 오지 않는 주인을 매일같이 기다리는데,가족
